reference,text,chapter,verse,sub_source,color,word_count,source_file,parsing_date
Deuteronomy 29,"Then the man that lay with her shall give unto the damsel's father fifty shekels of silver, and she shall be his wife; because he hath humbled her, he may not put her away all his days.",1,29,Core,#000000,37,Deuteronomist_source.wikitext,2025-08-18T18:16:26.194513
Deuteronomy 30,"A man shall not take his father's wife, nor discover his father's skirt.",1,30,Core,#000000,13,Deuteronomist_source.wikitext,2025-08-18T18:16:26.194513
Deuteronomy 1,"He that is wounded in the stones, or hath his privy member cut off, shall not enter into the congregation of the LORD.",1,1,Core,#000000,23,Deuteronomist_source.wikitext,2025-08-18T18:16:26.194513
Deuteronomy 2,A bastard shall not enter into the congregation of the LORD; even to his tenth generation shall he not enter into the congregation of the LORD.,1,2,Core,#000000,26,Deuteronomist_source.wikitext,2025-08-18T18:16:26.194513
Deuteronomy 3,An Ammonite or Moabite shall not enter into the congregation of the LORD; even to their tenth generation shall they not enter into the congregation of the LORD for ever:,1,3,Core,#000000,30,Deuteronomist_source.wikitext,2025-08-18T18:16:26.194513
Deuteronomy 4,"Because they met you not with bread and with water in the way, when ye came forth out of Egypt; and because they hired against thee Balaam the son of Beor of Pethor of Mesopotamia, to curse thee.",1,4,Core,#000000,38,Deuteronomist_source.wikitext,2025-08-18T18:16:26.194513
Deuteronomy 5,"Nevertheless the LORD thy God would not hearken unto Balaam; but the LORD thy God turned the curse into a blessing unto thee, because the LORD thy God loved thee.",1,5,Core,#000000,30,Deuteronomist_source.wikitext,2025-08-18T18:16:26.194513
Deuteronomy 6,Thou shalt not seek their peace nor their prosperity all thy days for ever.,1,6,Core,#000000,14,Deuteronomist_source.wikitext,2025-08-18T18:16:26.194513
Deuteronomy 7,Thou shalt not abhor an Edomite; for he is thy brother: thou shalt not abhor an Egyptian; because thou wast a stranger in his land.,1,7,Core,#000000,25,Deuteronomist_source.wikitext,2025-08-18T18:16:26.194513
Deuteronomy 8,The children that are begotten of them shall enter into the congregation of the LORD in their third generation.,1,8,Core,#000000,19,Deuteronomist_source.wikitext,2025-08-18T18:16:26.194513
Deuteronomy 9,"When the host goeth forth against thine enemies, then keep thee from every wicked thing.",1,9,Core,#000000,15,Deuteronomist_source.wikitext,2025-08-18T18:16:26.194513
Deuteronomy 10,"If there be among you any man, that is not clean by reason of uncleanness that chanceth him by night, then shall he go abroad out of the camp, he shall not come within the camp:",1,10,Core,#000000,36,Deuteronomist_source.wikitext,2025-08-18T18:16:26.194513
Deuteronomy 11,"But it shall be, when evening cometh on, he shall wash himself with water: and when the sun is down, he shall come into the camp again.",1,11,Core,#000000,27,Deuteronomist_source.wikitext,2025-08-18T18:16:26.194513
Deuteronomy 12,"Thou shalt have a place also without the camp, whither thou shalt go forth abroad:",1,12,Core,#000000,15,Deuteronomist_source.wikitext,2025-08-18T18:16:26.194513
Deuteronomy 13,"And thou shalt have a paddle upon thy weapon; and it shall be, when thou wilt ease thyself abroad, thou shalt dig therewith, and shalt turn back and cover that which cometh from thee:",1,13,Core,#000000,34,Deuteronomist_source.wikitext,2025-08-18T18:16:26.194513
Deuteronomy 14,"For the LORD thy God walketh in the midst of thy camp, to deliver thee, and to give up thine enemies before thee; therefore shall thy camp be holy: that he see no unclean thing in thee, and turn away from thee.",1,14,Core,#000000,42,Deuteronomist_source.wikitext,2025-08-18T18:16:26.194513
Deuteronomy 15,Thou shalt not deliver unto his master the servant which is escaped from his master unto thee:,1,15,Core,#000000,17,Deuteronomist_source.wikitext,2025-08-18T18:16:26.194513
Deuteronomy 16,"He shall dwell with thee, even among you, in that place which he shall choose in one of thy gates, where it liketh him best: thou shalt not oppress him.",1,16,Core,#000000,30,Deuteronomist_source.wikitext,2025-08-18T18:16:26.194513
Deuteronomy 17,"There shall be no whore of the daughters of Israel, nor a sodomite of the sons of Israel.",1,17,Core,#000000,18,Deuteronomist_source.wikitext,2025-08-18T18:16:26.194513
Deuteronomy 18,"Thou shalt not bring the hire of a whore, or the price of a dog, into the house of the LORD thy God for any vow: for even both these are abomination unto the LORD thy God.",1,18,Core,#000000,37,Deuteronomist_source.wikitext,2025-08-18T18:16:26.194513
Deuteronomy 19,"Thou shalt not lend upon usury to thy brother; usury of money, usury of victuals, usury of any thing that is lent upon usury:",1,19,Core,#000000,24,Deuteronomist_source.wikitext,2025-08-18T18:16:26.194513
Deuteronomy 20,Unto a stranger thou mayest lend upon usury; but unto thy brother thou shalt not lend upon usury: that the LORD thy God may bless thee in all that thou settest thine hand to in the land whither thou goest to possess it.,1,20,Core,#000000,43,Deuteronomist_source.wikitext,2025-08-18T18:16:26.194513
Deuteronomy 21,"When thou shalt vow a vow unto the LORD thy God, thou shalt not slack to pay it: for the LORD thy God will surely require it of thee; and it would be sin in thee.",1,21,Core,#000000,36,Deuteronomist_source.wikitext,2025-08-18T18:16:26.194513
Deuteronomy 22,"But if thou shalt forbear to vow, it shall be no sin in thee.",1,22,Core,#000000,14,Deuteronomist_source.wikitext,2025-08-18T18:16:26.194513
Deuteronomy 23,"That which is gone out of thy lips thou shalt keep and perform; even a freewill offering, according as thou hast vowed unto the LORD thy God, which thou hast promised with thy mouth.",1,23,Core,#000000,34,Deuteronomist_source.wikitext,2025-08-18T18:16:26.194513
Deuteronomy 24,"When thou comest into thy neighbour's vineyard, then thou mayest eat grapes thy fill at thine own pleasure; but thou shalt not put any in thy vessel.",1,24,Core,#000000,27,Deuteronomist_source.wikitext,2025-08-18T18:16:26.194513
Deuteronomy 25,"When thou comest into the standing corn of thy neighbour, then thou mayest pluck the ears with thine hand; but thou shalt not move a sickle unto thy neighbour's standing corn.",1,25,Core,#000000,31,Deuteronomist_source.wikitext,2025-08-18T18:16:26.194513
Deuteronomy 1,"When a man hath taken a wife, and married her, and it come to pass that she find no favour in his eyes, because he hath found some uncleanness in her: then let him write her a bill of divorcement, and give it in her hand, and send her out of his house.",1,1,Core,#000000,53,Deuteronomist_source.wikitext,2025-08-18T18:16:26.194513
Deuteronomy 2,"And when she is departed out of his house, she may go and be another man's wife.",1,2,Core,#000000,17,Deuteronomist_source.wikitext,2025-08-18T18:16:26.194513
Deuteronomy 3,"And if the latter husband hate her, and write her a bill of divorcement, and giveth it in her hand, and sendeth her out of his house; or if the latter husband die, which took her to be his wife;",1,3,Core,#000000,40,Deuteronomist_source.wikitext,2025-08-18T18:16:26.194513
Deuteronomy 4,"Her former husband, which sent her away, may not take her again to be his wife, after that she is defiled; for that is abomination before the LORD: and thou shalt not cause the land to sin, which the LORD thy God giveth thee for an inheritance.",1,4,Core,#000000,47,Deuteronomist_source.wikitext,2025-08-18T18:16:26.194513
Deuteronomy 5,"When a man hath taken a new wife, he shall not go out to war, neither shall he be charged with any business: but he shall be free at home one year, and shall cheer up his wife which he hath taken.",1,5,Core,#000000,42,Deuteronomist_source.wikitext,2025-08-18T18:16:26.194513
Deuteronomy 6,No man shall take the nether or the upper millstone to pledge: for he taketh a man's life to pledge.,1,6,Core,#000000,20,Deuteronomist_source.wikitext,2025-08-18T18:16:26.194513
Deuteronomy 7,"If a man be found stealing any of his brethren of the children of Israel, and maketh merchandise of him, or selleth him; then that thief shall die; and thou shalt put evil away from among you.",1,7,Core,#000000,37,Deuteronomist_source.wikitext,2025-08-18T18:16:26.194513
Deuteronomy 8,"Take heed in the plague of leprosy, that thou observe diligently, and do according to all that the priests the Levites shall teach you: as I commanded them, so ye shall observe to do.",1,8,Core,#000000,34,Deuteronomist_source.wikitext,2025-08-18T18:16:26.194513
Deuteronomy 9,"Remember what the LORD thy God did unto Miriam by the way, after that ye were come forth out of Egypt.",1,9,Core,#000000,21,Deuteronomist_source.wikitext,2025-08-18T18:16:26.194513
Deuteronomy 10,"When thou dost lend thy brother any thing, thou shalt not go into his house to fetch his pledge.",1,10,Core,#000000,19,Deuteronomist_source.wikitext,2025-08-18T18:16:26.194513
Deuteronomy 11,"Thou shalt stand abroad, and the man to whom thou dost lend shall bring out the pledge abroad unto thee.",1,11,Core,#000000,20,Deuteronomist_source.wikitext,2025-08-18T18:16:26.194513
Deuteronomy 12,"And if the man be poor, thou shalt not sleep with his pledge:",1,12,Core,#000000,13,Deuteronomist_source.wikitext,2025-08-18T18:16:26.194513
Deuteronomy 13,"In any case thou shalt deliver him the pledge again when the sun goeth down, that he may sleep in his own raiment, and bless thee: and it shall be righteousness unto thee before the LORD thy God.",1,13,Core,#000000,38,Deuteronomist_source.wikitext,2025-08-18T18:16:26.194513
Deuteronomy 14,"Thou shalt not oppress an hired servant that is poor and needy, whether he be of thy brethren, or of thy strangers that are in thy land within thy gates:",1,14,Core,#000000,30,Deuteronomist_source.wikitext,2025-08-18T18:16:26.194513
Deuteronomy 15,"At his day thou shalt give him his hire, neither shall the sun go down upon it; for he is poor, and setteth his heart upon it: lest he cry against thee unto the LORD, and it be sin unto thee.",1,15,Core,#000000,41,Deuteronomist_source.wikitext,2025-08-18T18:16:26.194513
Deuteronomy 16,"Thou shalt not pervert the judgment of the stranger, nor of the fatherless; nor take a widow's raiment to pledge:",1,16,Core,#000000,20,Deuteronomist_source.wikitext,2025-08-18T18:16:26.194513
Deuteronomy 17,"But thou shalt remember that thou wast a bondman in Egypt, and the LORD thy God redeemed thee thence: therefore I command thee to do this thing.",1,17,Core,#000000,27,Deuteronomist_source.wikitext,2025-08-18T18:16:26.194513
Deuteronomy 18,"When thou cuttest down thine harvest in thy field, and hast forgot a sheaf in the field, thou shalt not go again to fetch it: it shall be for the stranger, for the fatherless, and for the widow: that the LORD thy God may bless thee in all the work of thine hands.",1,18,Core,#000000,53,Deuteronomist_source.wikitext,2025-08-18T18:16:26.194513
Deuteronomy 19,"When thou beatest thine olive tree, thou shalt not go over the boughs again: it shall be for the stranger, for the fatherless, and for the widow.",1,19,Core,#000000,27,Deuteronomist_source.wikitext,2025-08-18T18:16:26.194513
Deuteronomy 20,"When thou gatherest the grapes of thy vineyard, thou shalt not glean it afterward: it shall be for the stranger, for the fatherless, and for the widow.",1,20,Core,#000000,27,Deuteronomist_source.wikitext,2025-08-18T18:16:26.194513
Deuteronomy 21,And thou shalt remember that thou wast a bondman in the land of Egypt: therefore I command thee to do this thing.,1,21,Core,#000000,22,Deuteronomist_source.wikitext,2025-08-18T18:16:26.194513
Deuteronomy 1,"If there be a controversy between men, and they come unto judgment, that the judges may judge them; then they shall justify the righteous, and condemn the wicked.",1,1,Core,#000000,28,Deuteronomist_source.wikitext,2025-08-18T18:16:26.194513
Deuteronomy 2,"And it shall be, if the wicked man be worthy to be beaten, that the judge shall cause him to lie down, and to be beaten before his face, according to his fault, by a certain number.",1,2,Core,#000000,37,Deuteronomist_source.wikitext,2025-08-18T18:16:26.194513
Deuteronomy 3,"Forty stripes he may give him, and not exceed: lest, if he should exceed, and beat him above these with many stripes, then thy brother should seem vile unto thee.",1,3,Core,#000000,30,Deuteronomist_source.wikitext,2025-08-18T18:16:26.194513
Deuteronomy 4,Thou shalt not muzzle the ox when he treadeth out the corn,1,4,Core,#000000,12,Deuteronomist_source.wikitext,2025-08-18T18:16:26.194513
Deuteronomy 5,"If brethren dwell together, and one of them die, and have no child, the wife of the dead shall not marry without unto a stranger: her husband's brother shall go in unto her, and take her to him to wife, and perform the duty of an husband's brother unto her.",1,5,Core,#000000,50,Deuteronomist_source.wikitext,2025-08-18T18:16:26.194513
Deuteronomy 6,"And it shall be, that the firstborn which she beareth shall succeed in the name of his brother which is dead, that his name be not put out of Israel.",1,6,Core,#000000,30,Deuteronomist_source.wikitext,2025-08-18T18:16:26.194513
Deuteronomy 7,"And if the man like not to take his brother's wife, then let his brother's wife go up to the gate unto the elders, and say, My husband's brother refuseth to raise up unto his brother a name in Israel, he will not perform the duty of my husband's brother.",1,7,Core,#000000,50,Deuteronomist_source.wikitext,2025-08-18T18:16:26.194513
Deuteronomy 8,"Then the elders of his city shall call him, and speak unto him: and if he stand to it, and say, I like not to take her;",1,8,Core,#000000,27,Deuteronomist_source.wikitext,2025-08-18T18:16:26.194513
Deuteronomy 9,"Then shall his brother's wife come unto him in the presence of the elders, and loose his shoe from off his foot, and spit in his face, and shall answer and say, So shall it be done unto that man that will not build up his brother's house.",1,9,Core,#000000,48,Deuteronomist_source.wikitext,2025-08-18T18:16:26.194513
Deuteronomy 10,"And his name shall be called in Israel, The house of him that hath his shoe loosed.",1,10,Core,#000000,17,Deuteronomist_source.wikitext,2025-08-18T18:16:26.194513
Deuteronomy 11,"When men strive together one with another, and the wife of the one draweth near for to deliver her husband out of the hand of him that smiteth him, and putteth forth her hand, and taketh him by the secrets:",1,11,Core,#000000,40,Deuteronomist_source.wikitext,2025-08-18T18:16:26.194513
Deuteronomy 12,"Then thou shalt cut off her hand, thine eye shall not pity her.",1,12,Core,#000000,13,Deuteronomist_source.wikitext,2025-08-18T18:16:26.194513
Deuteronomy 13,"Thou shalt not have in thy bag divers weights, a great and a small.",1,13,Core,#000000,14,Deuteronomist_source.wikitext,2025-08-18T18:16:26.194513
Deuteronomy 14,"Thou shalt not have in thine house divers measures, a great and a small.",1,14,Core,#000000,14,Deuteronomist_source.wikitext,2025-08-18T18:16:26.194513
Deuteronomy 15,"But thou shalt have a perfect and just weight, a perfect and just measure shalt thou have: that thy days may be lengthened in the land which the LORD thy God giveth thee.",1,15,Core,#000000,33,Deuteronomist_source.wikitext,2025-08-18T18:16:26.194513
Deuteronomy 16,"For all that do such things, and all that do unrighteously, are an abomination unto the LORD thy God.",1,16,Core,#000000,19,Deuteronomist_source.wikitext,2025-08-18T18:16:26.194513
Deuteronomy 17,"Remember what Amalek did unto thee by the way, when ye were come forth out of Egypt;",1,17,Core,#000000,17,Deuteronomist_source.wikitext,2025-08-18T18:16:26.194513
Deuteronomy 18,"How he met thee by the way, and smote the hindmost of thee, even all that were feeble behind thee, when thou wast faint and weary; and he feared not God.",1,18,Core,#000000,31,Deuteronomist_source.wikitext,2025-08-18T18:16:26.194513
Deuteronomy 19,"Therefore it shall be, when the LORD thy God hath given thee rest from all thine enemies round about, in the land which the LORD thy God giveth thee for an inheritance to possess it, that thou shalt blot out the remembrance of Amalek from under heaven; thou shalt not forget it.",1,19,Core,#000000,52,Deuteronomist_source.wikitext,2025-08-18T18:16:26.194513
Deuteronomy 1,"And it shall be, when thou art come in unto the land which the LORD thy God giveth thee for an inheritance, and possessest it, and dwellest therein;",1,1,Core,#000000,28,Deuteronomist_source.wikitext,2025-08-18T18:16:26.194513
Deuteronomy 2,"That thou shalt take of the first of all the fruit of the earth, which thou shalt bring of thy land that the LORD thy God giveth thee, and shalt put it in a basket, and shalt go unto the place which the LORD thy God shall choose to place his name there.",1,2,Core,#000000,53,Deuteronomist_source.wikitext,2025-08-18T18:16:26.194513
Deuteronomy 3,"And thou shalt go unto the priest that shall be in those days, and say unto him, I profess this day unto the LORD thy God, that I am come unto the country which the LORD sware unto our fathers for to give us.",1,3,Core,#000000,44,Deuteronomist_source.wikitext,2025-08-18T18:16:26.194513
Deuteronomy 4,"And the priest shall take the basket out of thine hand, and set it down before the altar of the LORD thy God.",1,4,Core,#000000,23,Deuteronomist_source.wikitext,2025-08-18T18:16:26.194513
Deuteronomy 5,"And thou shalt speak and say before the LORD thy God, A Syrian ready to perish was my father, and he went down into Egypt, and sojourned there with a few, and became there a nation, great, mighty, and populous:",1,5,Core,#000000,40,Deuteronomist_source.wikitext,2025-08-18T18:16:26.194513
Deuteronomy 6,"And the Egyptians evil entreated us, and afflicted us, and laid upon us hard bondage:",1,6,Core,#000000,15,Deuteronomist_source.wikitext,2025-08-18T18:16:26.194513
Deuteronomy 7,"And when we cried unto the LORD God of our fathers, the LORD heard our voice, and looked on our affliction, and our labour, and our oppression:",1,7,Core,#000000,27,Deuteronomist_source.wikitext,2025-08-18T18:16:26.194513
Deuteronomy 8,"And the LORD brought us forth out of Egypt with a mighty hand, and with an outstretched arm, and with great terribleness, and with signs, and with wonders:",1,8,Core,#000000,28,Deuteronomist_source.wikitext,2025-08-18T18:16:26.194513
Deuteronomy 9,"And he hath brought us into this place, and hath given us this land, even a land that floweth with milk and honey.",1,9,Core,#000000,23,Deuteronomist_source.wikitext,2025-08-18T18:16:26.194513
Deuteronomy 10,"And now, behold, I have brought the firstfruits of the land, which thou, O LORD, hast given me. And thou shalt set it before the LORD thy God, and worship before the LORD thy God:",1,10,Core,#000000,35,Deuteronomist_source.wikitext,2025-08-18T18:16:26.194513
Deuteronomy 11,"And thou shalt rejoice in every good thing which the LORD thy God hath given unto thee, and unto thine house, thou, and the Levite, and the stranger that is among you.",1,11,Core,#000000,32,Deuteronomist_source.wikitext,2025-08-18T18:16:26.194513
Deuteronomy 12,"When thou hast made an end of tithing all the tithes of thine increase the third year, which is the year of tithing, and hast given it unto the Levite, the stranger, the fatherless, and the widow, that they may eat within thy gates, and be filled;",1,12,Core,#000000,47,Deuteronomist_source.wikitext,2025-08-18T18:16:26.194513
Deuteronomy 13,"Then thou shalt say before the LORD thy God, I have brought away the hallowed things out of mine house, and also have given them unto the Levite, and unto the stranger, to the fatherless, and to the widow, according to all thy commandments which thou hast commanded me: I have not transgressed thy commandments, neither have I forgotten them.",1,13,Core,#000000,60,Deuteronomist_source.wikitext,2025-08-18T18:16:26.194513
Deuteronomy 14,"I have not eaten thereof in my mourning, neither have I taken away ought thereof for any unclean use, nor given ought thereof for the dead: but I have hearkened to the voice of the LORD my God, and have done according to all that thou hast commanded me.",1,14,Core,#000000,49,Deuteronomist_source.wikitext,2025-08-18T18:16:26.194513
Deuteronomy 15,"Look down from thy holy habitation, from heaven, and bless thy people Israel, and the land which thou hast given us, as thou swarest unto our fathers, a land that floweth with milk and honey.",1,15,Core,#000000,35,Deuteronomist_source.wikitext,2025-08-18T18:16:26.194513
Deuteronomy 16,"This day the LORD thy God hath commanded thee to do these statutes and judgments: thou shalt therefore keep and do them with all thine heart, and with all thy soul.",1,16,Core,#000000,31,Deuteronomist_source.wikitext,2025-08-18T18:16:26.194513
Deuteronomy 17,"Thou hast avouched the LORD this day to be thy God, and to walk in his ways, and to keep his statutes, and his commandments, and his judgments, and to hearken unto his voice:",1,17,Core,#000000,34,Deuteronomist_source.wikitext,2025-08-18T18:16:26.194513
Deuteronomy 18,"And the LORD hath avouched thee this day to be his peculiar people, as he hath promised thee, and that thou shouldest keep all his commandments;",1,18,Core,#000000,26,Deuteronomist_source.wikitext,2025-08-18T18:16:26.194513
Deuteronomy 19,"And to make thee high above all nations which he hath made, in praise, and in name, and in honour; and that thou mayest be an holy people unto the LORD thy God, as he hath spoken.",1,19,Core,#000000,37,Deuteronomist_source.wikitext,2025-08-18T18:16:26.194513
Deuteronomy 1,"And Moses with the elders of Israel commanded the people, saying, Keep all the commandments which I command you this day.",1,1,Dtr2,#008800,21,Deuteronomist_source.wikitext,2025-08-18T18:16:26.194513
Deuteronomy 2,"And it shall be on the day when ye shall pass over Jordan unto the land which the LORD thy God giveth thee, that thou shalt set thee up great stones, and plaister them with plaister:",1,2,Dtr2,#008800,36,Deuteronomist_source.wikitext,2025-08-18T18:16:26.194513
Deuteronomy 3,"And thou shalt write upon them all the words of this law, when thou art passed over, that thou mayest go in unto the land which the LORD thy God giveth thee, a land that floweth with milk and honey; as the LORD God of thy fathers hath promised thee.",1,3,Dtr2,#008800,50,Deuteronomist_source.wikitext,2025-08-18T18:16:26.194513
Deuteronomy 4,"And there shalt thou build an altar unto the LORD thy God, an altar of stones: thou shalt not lift up any iron tool upon them.",1,4,Dtr2,#008800,26,Deuteronomist_source.wikitext,2025-08-18T18:16:26.194513
Deuteronomy 5,Thou shalt build the altar of the LORD thy God of whole stones: and thou shalt offer burnt offerings thereon unto the LORD thy God:,1,5,Dtr2,#008800,25,Deuteronomist_source.wikitext,2025-08-18T18:16:26.194513
Deuteronomy 6,"And thou shalt offer peace offerings, and shalt eat there, and rejoice before the LORD thy God.",1,6,Dtr2,#008800,17,Deuteronomist_source.wikitext,2025-08-18T18:16:26.194513
Deuteronomy 7,"And Moses and the priests the Levites spake unto all Israel, saying, Take heed, and hearken, O Israel; this day thou art become the people of the LORD thy God.",1,7,Dtr2,#008800,30,Deuteronomist_source.wikitext,2025-08-18T18:16:26.194513
Deuteronomy 8,"Thou shalt therefore obey the voice of the LORD thy God, and do his commandments and his statutes, which I command thee this day.",1,8,Dtr2,#008800,24,Deuteronomist_source.wikitext,2025-08-18T18:16:26.194513
Deuteronomy 6,"And thou shalt offer peace offerings, and shalt eat there, and rejoice before the LORD thy God.",1,6,Dtr2,#008800,17,Deuteronomist_source.wikitext,2025-08-18T18:16:26.194513
Deuteronomy 7,"And Moses and the priests the Levites spake unto all Israel, saying, Take heed, and hearken, O Israel; this day thou art become the people of the LORD thy God.",1,7,Dtr2,#008800,30,Deuteronomist_source.wikitext,2025-08-18T18:16:26.194513
Deuteronomy 8,"Thou shalt therefore obey the voice of the LORD thy God, and do his commandments and his statutes, which I command thee this day.",1,8,Dtr2,#008800,24,Deuteronomist_source.wikitext,2025-08-18T18:16:26.194513
Deuteronomy 1,"And it shall come to pass, if thou shalt hearken diligently unto the voice of the LORD thy God, to observe and to do all his commandments which I command thee this day, that the LORD thy God will set thee on high above all nations of the earth:",1,1,Dtr2,#008800,49,Deuteronomist_source.wikitext,2025-08-18T18:16:26.194513
Deuteronomy 2,"And all these blessings shall come on thee, and overtake thee, if thou shalt hearken unto the voice of the LORD thy God.",1,2,Dtr2,#008800,23,Deuteronomist_source.wikitext,2025-08-18T18:16:26.194513
Deuteronomy 3,"Blessed shalt thou be in the city, and blessed shalt thou be in the field.",1,3,Dtr2,#008800,15,Deuteronomist_source.wikitext,2025-08-18T18:16:26.194513
Deuteronomy 4,"Blessed shall be the fruit of thy body, and the fruit of thy ground, and the fruit of thy cattle, the increase of thy kine, and the flocks of thy sheep.",1,4,Dtr2,#008800,31,Deuteronomist_source.wikitext,2025-08-18T18:16:26.194513
Deuteronomy 5,Blessed shall be thy basket and thy store.,1,5,Dtr2,#008800,8,Deuteronomist_source.wikitext,2025-08-18T18:16:26.194513
Deuteronomy 6,"Blessed shalt thou be when thou comest in, and blessed shalt thou be when thou goest out.",1,6,Dtr2,#008800,17,Deuteronomist_source.wikitext,2025-08-18T18:16:26.194513
Deuteronomy 7,"The LORD shall cause thine enemies that rise up against thee to be smitten before thy face: they shall come out against thee one way, and flee before thee seven ways.",1,7,Dtr2,#008800,31,Deuteronomist_source.wikitext,2025-08-18T18:16:26.194513
