reference,text,chapter,verse,sub_source,color,word_count,source_file,parsing_date
Deuteronomy 1,"These be the words which Moses spake unto all Israel on this side Jordan in the wilderness, in the plain over against the Red sea, between Paran, and Tophel, and Laban, and Hazeroth, and Dizahab.",1,1,Dtr2,#008800,35,Deuteronomist_source.wikitext,2025-08-18T18:16:26.190513
Deuteronomy 2,(There are eleven days' journey from Horeb by the way of mount Seir unto Kadeshbarnea.),1,2,Dtr2,#008800,15,Deuteronomist_source.wikitext,2025-08-18T18:16:26.190513
Deuteronomy 3,"After he had slain Sihon the king of the Amorites, which dwelt in Heshbon, and Og the king of Bashan, which dwelt at Astaroth in Edrei:",1,3,Dtr2,#008800,26,Deuteronomist_source.wikitext,2025-08-18T18:16:26.190513
Deuteronomy 4,"On this side Jordan, in the land of Moab, began Moses to declare this law, saying,",1,4,Dtr2,#008800,16,Deuteronomist_source.wikitext,2025-08-18T18:16:26.190513
Deuteronomy 1,"After he had slain Sihon the king of the Amorites, which dwelt in Heshbon, and Og the king of Bashan, which dwelt at Astaroth in Edrei:",1,1,Dtr2,#008800,26,Deuteronomist_source.wikitext,2025-08-18T18:16:26.190513
Deuteronomy 2,"On this side Jordan, in the land of Moab, began Moses to declare this law, saying,",1,2,Dtr2,#008800,16,Deuteronomist_source.wikitext,2025-08-18T18:16:26.190513
Deuteronomy 3,"The LORD our God spake unto us in Horeb, saying, Ye have dwelt long enough in this mount:",1,3,Dtr2,#008800,18,Deuteronomist_source.wikitext,2025-08-18T18:16:26.190513
Deuteronomy 4,"Turn you, and take your journey, and go to the mount of the Amorites, and unto all the places nigh thereunto, in the plain, in the hills, and in the vale, and in the south, and by the sea side, to the land of the Canaanites, and unto Lebanon, unto the great river, the river Euphrates.",1,4,Dtr2,#008800,56,Deuteronomist_source.wikitext,2025-08-18T18:16:26.190513
Deuteronomy 5,"Behold, I have set the land before you: go in and possess the land which the LORD sware unto your fathers, Abraham, Isaac, and Jacob, to give unto them and to their seed after them.",1,5,Dtr2,#008800,35,Deuteronomist_source.wikitext,2025-08-18T18:16:26.190513
Deuteronomy 6,"And I spake unto you at that time, saying, I am not able to bear you myself alone:",1,6,Dtr2,#008800,18,Deuteronomist_source.wikitext,2025-08-18T18:16:26.190513
Deuteronomy 7,"The LORD your God hath multiplied you, and, behold, ye are this day as the stars of heaven for multitude.",1,7,Dtr2,#008800,20,Deuteronomist_source.wikitext,2025-08-18T18:16:26.190513
Deuteronomy 8,"(The LORD God of your fathers make you a thousand times so many more as ye are, and bless you, as he hath promised you!)",1,8,Dtr2,#008800,25,Deuteronomist_source.wikitext,2025-08-18T18:16:26.190513
Deuteronomy 9,"How can I myself alone bear your cumbrance, and your burden, and your strife?",1,9,Dtr2,#008800,14,Deuteronomist_source.wikitext,2025-08-18T18:16:26.190513
Deuteronomy 10,"Take you wise men, and understanding, and known among your tribes, and I will make them rulers over you.",1,10,Dtr2,#008800,19,Deuteronomist_source.wikitext,2025-08-18T18:16:26.190513
Deuteronomy 11,"And ye answered me, and said, The thing which thou hast spoken is good for us to do.",1,11,Dtr2,#008800,18,Deuteronomist_source.wikitext,2025-08-18T18:16:26.190513
Deuteronomy 12,"So I took the chief of your tribes, wise men, and known, and made them heads over you, captains over thousands, and captains over hundreds, and captains over fifties, and captains over tens, and officers among your tribes.",1,12,Dtr2,#008800,38,Deuteronomist_source.wikitext,2025-08-18T18:16:26.190513
Deuteronomy 13,"And I charged your judges at that time, saying, Hear the causes between your brethren, and judge righteously between every man and his brother, and the stranger that is with him.",1,13,Dtr2,#008800,31,Deuteronomist_source.wikitext,2025-08-18T18:16:26.190513
Deuteronomy 14,"Ye shall not respect persons in judgment; but ye shall hear the small as well as the great; ye shall not be afraid of the face of man; for the judgment is God's: and the cause that is too hard for you, bring it unto me, and I will hear it.",1,14,Dtr2,#008800,51,Deuteronomist_source.wikitext,2025-08-18T18:16:26.190513
Deuteronomy 15,And I commanded you at that time all the things which ye should do.,1,15,Dtr2,#008800,14,Deuteronomist_source.wikitext,2025-08-18T18:16:26.190513
Deuteronomy 16,"And when we departed from Horeb, we went through all that great and terrible wilderness, which ye saw by the way of the mountain of the Amorites, as the LORD our God commanded us; and we came to Kadeshbarnea.",1,16,Dtr2,#008800,39,Deuteronomist_source.wikitext,2025-08-18T18:16:26.190513
Deuteronomy 17,"And I said unto you, Ye are come unto the mountain of the Amorites, which the LORD our God doth give unto us.",1,17,Dtr2,#008800,23,Deuteronomist_source.wikitext,2025-08-18T18:16:26.190513
Deuteronomy 18,"Behold, the LORD thy God hath set the land before thee: go up and possess it, as the LORD God of thy fathers hath said unto thee; fear not, neither be discouraged.",1,18,Dtr2,#008800,32,Deuteronomist_source.wikitext,2025-08-18T18:16:26.190513
Deuteronomy 19,"And ye came near unto me every one of you, and said, We will send men before us, and they shall search us out the land, and bring us word again by what way we must go up, and into what cities we shall come.",1,19,Dtr2,#008800,45,Deuteronomist_source.wikitext,2025-08-18T18:16:26.190513
Deuteronomy 20,"And the saying pleased me well: and I took twelve men of you, one of a tribe:",1,20,Dtr2,#008800,17,Deuteronomist_source.wikitext,2025-08-18T18:16:26.190513
Deuteronomy 21,"And they turned and went up into the mountain, and came unto the valley of Eshcol, and searched it out.",1,21,Dtr2,#008800,20,Deuteronomist_source.wikitext,2025-08-18T18:16:26.190513
Deuteronomy 22,"And they took of the fruit of the land in their hands, and brought it down unto us, and brought us word again, and said, It is a good land which the LORD our God doth give us.",1,22,Dtr2,#008800,38,Deuteronomist_source.wikitext,2025-08-18T18:16:26.190513
Deuteronomy 23,"Notwithstanding ye would not go up, but rebelled against the commandment of the LORD your God:",1,23,Dtr2,#008800,16,Deuteronomist_source.wikitext,2025-08-18T18:16:26.190513
Deuteronomy 24,"And ye murmured in your tents, and said, Because the LORD hated us, he hath brought us forth out of the land of Egypt, to deliver us into the hand of the Amorites, to destroy us.",1,24,Dtr2,#008800,36,Deuteronomist_source.wikitext,2025-08-18T18:16:26.190513
Deuteronomy 25,"Whither shall we go up? our brethren have discouraged our heart, saying, The people is greater and taller than we; the cities are great and walled up to heaven; and moreover we have seen the sons of the Anakims there.",1,25,Dtr2,#008800,40,Deuteronomist_source.wikitext,2025-08-18T18:16:26.190513
Deuteronomy 26,"Then I said unto you, Dread not, neither be afraid of them.",1,26,Dtr2,#008800,12,Deuteronomist_source.wikitext,2025-08-18T18:16:26.190513
Deuteronomy 27,"The LORD your God which goeth before you, he shall fight for you, according to all that he did for you in Egypt before your eyes;",1,27,Dtr2,#008800,26,Deuteronomist_source.wikitext,2025-08-18T18:16:26.190513
Deuteronomy 28,"And in the wilderness, where thou hast seen how that the LORD thy God bare thee, as a man doth bear his son, in all the way that ye went, until ye came into this place.",1,28,Dtr2,#008800,36,Deuteronomist_source.wikitext,2025-08-18T18:16:26.190513
Deuteronomy 29,"Yet in this thing ye did not believe the LORD your God,",1,29,Dtr2,#008800,12,Deuteronomist_source.wikitext,2025-08-18T18:16:26.190513
Deuteronomy 30,"Who went in the way before you, to search you out a place to pitch your tents in, in fire by night, to shew you by what way ye should go, and in a cloud by day.",1,30,Dtr2,#008800,37,Deuteronomist_source.wikitext,2025-08-18T18:16:26.190513
Deuteronomy 31,"And the LORD heard the voice of your words, and was wroth, and sware, saying,",1,31,Dtr2,#008800,15,Deuteronomist_source.wikitext,2025-08-18T18:16:26.190513
Deuteronomy 32,"Surely there shall not one of these men of this evil generation see that good land, which I sware to give unto your fathers.",1,32,Dtr2,#008800,24,Deuteronomist_source.wikitext,2025-08-18T18:16:26.190513
Deuteronomy 33,"Save Caleb the son of Jephunneh; he shall see it, and to him will I give the land that he hath trodden upon, and to his children, because he hath wholly followed the LORD.",1,33,Dtr2,#008800,34,Deuteronomist_source.wikitext,2025-08-18T18:16:26.190513
Deuteronomy 34,"Also the LORD was angry with me for your sakes, saying, Thou also shalt not go in thither.",1,34,Dtr2,#008800,18,Deuteronomist_source.wikitext,2025-08-18T18:16:26.190513
Deuteronomy 35,"But Joshua the son of Nun, which standeth before thee, he shall go in thither: encourage him: for he shall cause Israel to inherit it.",1,35,Dtr2,#008800,25,Deuteronomist_source.wikitext,2025-08-18T18:16:26.190513
Deuteronomy 36,"But as for you, turn you, and take your journey into the wilderness by the way of the Red sea.",1,36,Dtr2,#008800,20,Deuteronomist_source.wikitext,2025-08-18T18:16:26.190513
Deuteronomy 37,"Then ye answered and said unto me, We have sinned against the LORD, we will go up and fight, according to all that the LORD our God commanded us. And when ye had girded on every man his weapons of war, ye were ready to go up into the hill.",1,37,Late_insertion,#880000,50,Deuteronomist_source.wikitext,2025-08-18T18:16:26.190513
Deuteronomy 38,"And the LORD said unto me, Say unto them. Go not up, neither fight; for I am not among you; lest ye be smitten before your enemies.",1,38,Late_insertion,#880000,27,Deuteronomist_source.wikitext,2025-08-18T18:16:26.190513
Deuteronomy 39,"So I spake unto you; and ye would not hear, but rebelled against the commandment of the LORD, and went presumptuously up into the hill.",1,39,Late_insertion,#880000,25,Deuteronomist_source.wikitext,2025-08-18T18:16:26.190513
Deuteronomy 40,"And the Amorites, which dwelt in that mountain, came out against you, and chased you, as bees do, and destroyed you in Seir, even unto Hormah.",1,40,Dtr2,#008800,26,Deuteronomist_source.wikitext,2025-08-18T18:16:26.190513
Deuteronomy 41,"And ye returned and wept before the LORD; but the LORD would not hearken to your voice, nor give ear unto you.",1,41,Dtr2,#008800,22,Deuteronomist_source.wikitext,2025-08-18T18:16:26.190513
Deuteronomy 42,"So ye abode in Kadesh many days, according unto the days that ye abode there.",1,42,Dtr2,#008800,15,Deuteronomist_source.wikitext,2025-08-18T18:16:26.190513
Deuteronomy 43,"Then we turned, and took our journey into the wilderness by the way of the Red sea, as the LORD spake unto me: and we compassed mount Seir many days.",1,43,Dtr2,#008800,30,Deuteronomist_source.wikitext,2025-08-18T18:16:26.190513
Deuteronomy 44,"And the LORD spake unto me, saying,",1,44,Dtr2,#008800,7,Deuteronomist_source.wikitext,2025-08-18T18:16:26.190513
Deuteronomy 45,Ye have compassed this mountain long enough: turn you northward.,1,45,Dtr2,#008800,10,Deuteronomist_source.wikitext,2025-08-18T18:16:26.190513
Deuteronomy 46,"And command thou the people, saying, Ye are to pass through the coast of your brethren the children of Esau, which dwell in Seir; and they shall be afraid of you: take ye good heed unto yourselves therefore:",1,46,Dtr2,#008800,38,Deuteronomist_source.wikitext,2025-08-18T18:16:26.190513
Deuteronomy 47,"Meddle not with them; for I will not give you of their land, no, not so much as a foot breadth; because I have given mount Seir unto Esau for a possession.",1,47,Dtr2,#008800,32,Deuteronomist_source.wikitext,2025-08-18T18:16:26.190513
Deuteronomy 48,"Ye shall buy meat of them for money, that ye may eat; and ye shall also buy water of them for money, that ye may drink.",1,48,Dtr2,#008800,26,Deuteronomist_source.wikitext,2025-08-18T18:16:26.190513
Deuteronomy 49,For the LORD thy God hath blessed thee in all the works of thy hand: he knoweth thy walking through this great wilderness: these forty years the LORD thy God hath been with thee; thou hast lacked nothing.,1,49,Dtr2,#008800,38,Deuteronomist_source.wikitext,2025-08-18T18:16:26.190513
Deuteronomy 50,"And when we passed by from our brethren the children of Esau, which dwelt in Seir, through the way of the plain from Elath, and from Eziongaber, we turned and passed by the way of the wilderness of Moab.",1,50,Dtr2,#008800,39,Deuteronomist_source.wikitext,2025-08-18T18:16:26.190513
Deuteronomy 51,"And the LORD said unto me, Distress not the Moabites, neither contend with them in battle: for I will not give thee of their land for a possession; because I have given Ar unto the children of Lot for a possession.",1,51,Dtr2,#008800,41,Deuteronomist_source.wikitext,2025-08-18T18:16:26.190513
Deuteronomy 52,"Now rise up, said I, and get you over the brook Zered. And we went over the brook Zered.",1,52,Dtr2,#008800,19,Deuteronomist_source.wikitext,2025-08-18T18:16:26.190513
Deuteronomy 53,"That the LORD spake unto me, saying,",1,53,Dtr2,#008800,7,Deuteronomist_source.wikitext,2025-08-18T18:16:26.190513
Deuteronomy 54,"Thou art to pass over through Ar, the coast of Moab, this day:",1,54,Dtr2,#008800,13,Deuteronomist_source.wikitext,2025-08-18T18:16:26.190513
Deuteronomy 55,"And when thou comest nigh over against the children of Ammon, distress them not, nor meddle with them: for I will not give thee of the land of the children of Ammon any possession; because I have given it unto the children of Lot for a possession.",1,55,Dtr2,#008800,47,Deuteronomist_source.wikitext,2025-08-18T18:16:26.190513
Deuteronomy 56,"Rise ye up, take your journey, and pass over the river Arnon: behold, I have given into thine hand Sihon the Amorite, king of Heshbon, and his land: begin to possess it, and contend with him in battle.",1,56,Dtr2,#008800,38,Deuteronomist_source.wikitext,2025-08-18T18:16:26.190513
Deuteronomy 57,"This day will I begin to put the dread of thee and the fear of thee upon the nations that are under the whole heaven, who shall hear report of thee, and shall tremble, and be in anguish because of thee.",1,57,Dtr2,#008800,41,Deuteronomist_source.wikitext,2025-08-18T18:16:26.190513
Deuteronomy 58,"And I sent messengers out of the wilderness of Kedemoth unto Sihon king of Heshbon with words of peace, saying,",1,58,Dtr2,#008800,20,Deuteronomist_source.wikitext,2025-08-18T18:16:26.190513
Deuteronomy 59,"Let me pass through thy land: I will go along by the high way, I will neither turn unto the right hand nor to the left.",1,59,Dtr2,#008800,26,Deuteronomist_source.wikitext,2025-08-18T18:16:26.190513
Deuteronomy 60,"Thou shalt sell me meat for money, that I may eat; and give me water for money, that I may drink: only I will pass through on my feet;",1,60,Dtr2,#008800,29,Deuteronomist_source.wikitext,2025-08-18T18:16:26.190513
Deuteronomy 61,"(As the children of Esau which dwell in Seir, and the Moabites which dwell in Ar, did unto me;) until I shall pass over Jordan into the land which the LORD our God giveth us.",1,61,Dtr2,#008800,35,Deuteronomist_source.wikitext,2025-08-18T18:16:26.190513
Deuteronomy 62,"But Sihon king of Heshbon would not let us pass by him: for the LORD thy God hardened his spirit, and made his heart obstinate, that he might deliver him into thy hand, as appeareth this day.",1,62,Dtr2,#008800,37,Deuteronomist_source.wikitext,2025-08-18T18:16:26.190513
Deuteronomy 63,"And the LORD said unto me, Behold, I have begun to give Sihon and his land before thee: begin to possess, that thou mayest inherit his land.",1,63,Dtr2,#008800,27,Deuteronomist_source.wikitext,2025-08-18T18:16:26.190513
Deuteronomy 64,"Then Sihon came out against us, he and all his people, to fight at Jahaz.",1,64,Dtr2,#008800,15,Deuteronomist_source.wikitext,2025-08-18T18:16:26.190513
Deuteronomy 65,"And the LORD our God delivered him before us; and we smote him, and his sons, and all his people.",1,65,Dtr2,#008800,20,Deuteronomist_source.wikitext,2025-08-18T18:16:26.190513
Deuteronomy 66,"And we took all his cities at that time, and utterly destroyed the men, and the women, and the little ones, of every city, we left none to remain:",1,66,Dtr2,#008800,29,Deuteronomist_source.wikitext,2025-08-18T18:16:26.190513
Deuteronomy 67,"Only the cattle we took for a prey unto ourselves, and the spoil of the cities which we took.",1,67,Dtr2,#008800,19,Deuteronomist_source.wikitext,2025-08-18T18:16:26.190513
Deuteronomy 68,"From Aroer, which is by the brink of the river of Arnon, and from the city that is by the river, even unto Gilead, there was not one city too strong for us: the LORD our God delivered all unto us:",1,68,Dtr2,#008800,41,Deuteronomist_source.wikitext,2025-08-18T18:16:26.190513
Deuteronomy 69,"Only unto the land of the children of Ammon thou camest not, nor unto any place of the river Jabbok, nor unto the cities in the mountains, nor unto whatsoever the LORD our God forbad us.",1,69,Dtr2,#008800,36,Deuteronomist_source.wikitext,2025-08-18T18:16:26.190513
Deuteronomy 70,"Then we turned, and went up the way to Bashan: and Og the king of Bashan came out against us, he and all his people, to battle at Edrei.",1,70,Dtr2,#008800,29,Deuteronomist_source.wikitext,2025-08-18T18:16:26.190513
Deuteronomy 71,"And the LORD said unto me, Fear him not: for I will deliver him, and all his people, and his land, into thy hand; and thou shalt do unto him as thou didst unto Sihon king of the Amorites, which dwelt at Heshbon.",1,71,Dtr2,#008800,43,Deuteronomist_source.wikitext,2025-08-18T18:16:26.190513
Deuteronomy 72,"So the LORD our God delivered into our hands Og also, the king of Bashan, and all his people: and we smote him until none was left to him remaining.",1,72,Dtr2,#008800,30,Deuteronomist_source.wikitext,2025-08-18T18:16:26.190513
Deuteronomy 73,"And we took all his cities at that time, there was not a city which we took not from them, threescore cities, all the region of Argob, the kingdom of Og in Bashan.",1,73,Dtr2,#008800,33,Deuteronomist_source.wikitext,2025-08-18T18:16:26.190513
Deuteronomy 74,"All these cities were fenced with high walls, gates, and bars; beside unwalled towns a great many.",1,74,Dtr2,#008800,17,Deuteronomist_source.wikitext,2025-08-18T18:16:26.190513
Deuteronomy 75,"And we utterly destroyed them, as we did unto Sihon king of Heshbon, utterly destroying the men, women, and children, of every city.",1,75,Dtr2,#008800,23,Deuteronomist_source.wikitext,2025-08-18T18:16:26.190513
Deuteronomy 76,"But all the cattle, and the spoil of the cities, we took for a prey to ourselves.",1,76,Dtr2,#008800,17,Deuteronomist_source.wikitext,2025-08-18T18:16:26.190513
Deuteronomy 77,"And we took at that time out of the hand of the two kings of the Amorites the land that was on this side Jordan, from the river of Arnon unto mount Hermon;",1,77,Dtr2,#008800,33,Deuteronomist_source.wikitext,2025-08-18T18:16:26.190513
Deuteronomy 78,(Which Hermon the Sidonians call Sirion; and the Amorites call it Shenir;),1,78,Dtr2,#008800,12,Deuteronomist_source.wikitext,2025-08-18T18:16:26.190513
Deuteronomy 79,"All the cities of the plain, and all Gilead, and all Bashan, unto Salchah and Edrei, cities of the kingdom of Og in Bashan.",1,79,Dtr2,#008800,24,Deuteronomist_source.wikitext,2025-08-18T18:16:26.190513
Deuteronomy 80,"And this land, which we possessed at that time, from Aroer, which is by the river Arnon, and half mount Gilead, and the cities thereof, gave I unto the Reubenites and to the Gadites.",1,80,Dtr2,#008800,34,Deuteronomist_source.wikitext,2025-08-18T18:16:26.190513
Deuteronomy 81,"And the rest of Gilead, and all Bashan, being the kingdom of Og, gave I unto the half tribe of Manasseh; all the region of Argob, with all Bashan, which was called the land of giants.",1,81,Dtr2,#008800,36,Deuteronomist_source.wikitext,2025-08-18T18:16:26.190513
Deuteronomy 82,"Jair the son of Manasseh took all the country of Argob unto the coasts of Geshuri and Maachathi; and called them after his own name, Bashanhavothjair, unto this day.",1,82,Dtr2,#008800,29,Deuteronomist_source.wikitext,2025-08-18T18:16:26.190513
Deuteronomy 83,And I gave Gilead unto Machir.,1,83,Dtr2,#008800,6,Deuteronomist_source.wikitext,2025-08-18T18:16:26.190513
Deuteronomy 84,"And unto the Reubenites and unto the Gadites I gave from Gilead even unto the river Arnon half the valley, and the border even unto the river Jabbok, which is the border of the children of Ammon;",1,84,Dtr2,#008800,37,Deuteronomist_source.wikitext,2025-08-18T18:16:26.190513
Deuteronomy 85,"The plain also, and Jordan, and the coast thereof, from Chinnereth even unto the sea of the plain, even the salt sea, under Ashdothpisgah eastward.",1,85,Dtr2,#008800,25,Deuteronomist_source.wikitext,2025-08-18T18:16:26.190513
Deuteronomy 86,"And I commanded you at that time, saying, The LORD your God hath given you this land to possess it: ye shall pass over armed before your brethren the children of Israel, all that are meet for the war.",1,86,Dtr2,#008800,39,Deuteronomist_source.wikitext,2025-08-18T18:16:26.190513
Deuteronomy 87,"Until the LORD have given rest unto your brethren, as well as unto you, and until they also possess the land which the LORD your God hath given them beyond Jordan: and then shall ye return every man unto his possession, which I have given you.",1,87,Dtr2,#008800,46,Deuteronomist_source.wikitext,2025-08-18T18:16:26.190513
Deuteronomy 88,"And I commanded Joshua at that time, saying, Thine eyes have seen all that the LORD your God hath done unto these two kings: so shall the LORD do unto all the kingdoms whither thou passest.",1,88,Dtr2,#008800,36,Deuteronomist_source.wikitext,2025-08-18T18:16:26.190513
Deuteronomy 89,Ye shall not fear them: for the LORD your God he shall fight for you.,1,89,Dtr2,#008800,15,Deuteronomist_source.wikitext,2025-08-18T18:16:26.190513
Deuteronomy 90,"And I besought the LORD at that time, saying,",1,90,Dtr2,#008800,9,Deuteronomist_source.wikitext,2025-08-18T18:16:26.190513
Deuteronomy 91,"O Lord GOD, thou hast begun to shew thy servant thy greatness, and thy mighty hand: for what God is there in heaven or in earth, that can do according to thy works, and according to thy might?",1,91,Dtr2,#008800,38,Deuteronomist_source.wikitext,2025-08-18T18:16:26.190513
Deuteronomy 92,"I pray thee, let me go over, and see the good land that is beyond Jordan, that goodly mountain, and Lebanon.",1,92,Dtr2,#008800,21,Deuteronomist_source.wikitext,2025-08-18T18:16:26.190513
Deuteronomy 93,"But the LORD was wroth with me for your sakes, and would not hear me: and the LORD said unto me, Let it suffice thee; speak no more unto me of this matter.",1,93,Dtr2,#008800,33,Deuteronomist_source.wikitext,2025-08-18T18:16:26.190513
Deuteronomy 94,"Get thee up into the top of Pisgah, and lift up thine eyes westward, and northward, and southward, and eastward, and behold it with thine eyes: for thou shalt not go over this Jordan.",1,94,Dtr2,#008800,34,Deuteronomist_source.wikitext,2025-08-18T18:16:26.190513
Deuteronomy 95,"But charge Joshua, and encourage him, and strengthen him: for he shall go over before this people, and he shall cause them to inherit the land which thou shalt see.",1,95,Dtr2,#008800,30,Deuteronomist_source.wikitext,2025-08-18T18:16:26.190513
Deuteronomy 96,So we abode in the valley over against Bethpeor.,1,96,Dtr2,#008800,9,Deuteronomist_source.wikitext,2025-08-18T18:16:26.190513
Deuteronomy 1,"Now therefore hearken, O Israel, unto the statutes and unto the judgments, which I teach you, for to do them, that ye may live, and go in and possess the land which the LORD God of your fathers giveth you.",1,1,Dtr2,#008800,40,Deuteronomist_source.wikitext,2025-08-18T18:16:26.190513
Deuteronomy 2,"Ye shall not add unto the word which I command you, neither shall ye diminish ought from it, that ye may keep the commandments of the LORD your God which I command you.",1,2,Dtr2,#008800,33,Deuteronomist_source.wikitext,2025-08-18T18:16:26.190513
Deuteronomy 3,"Your eyes have seen what the LORD did because of Baalpeor: for all the men that followed Baalpeor, the LORD thy God hath destroyed them from among you.",1,3,Dtr2,#008800,28,Deuteronomist_source.wikitext,2025-08-18T18:16:26.190513
Deuteronomy 4,But ye that did cleave unto the LORD your God are alive every one of you this day.,1,4,Dtr2,#008800,18,Deuteronomist_source.wikitext,2025-08-18T18:16:26.190513
Deuteronomy 5,"Behold, I have taught you statutes and judgments, even as the LORD my God commanded me, that ye should do so in the land whither ye go to possess it.",1,5,Dtr2,#008800,30,Deuteronomist_source.wikitext,2025-08-18T18:16:26.190513
Deuteronomy 6,"Keep therefore and do them; for this is your wisdom and your understanding in the sight of the nations, which shall hear all these statutes, and say, Surely this great nation is a wise and understanding people.",1,6,Dtr2,#008800,37,Deuteronomist_source.wikitext,2025-08-18T18:16:26.190513
Deuteronomy 7,"For what nation is there so great, who hath God so nigh unto them, as the LORD our God is in all things that we call upon him for?",1,7,Dtr2,#008800,29,Deuteronomist_source.wikitext,2025-08-18T18:16:26.190513
Deuteronomy 8,"And what nation is there so great, that hath statutes and judgments so righteous as all this law, which I set before you this day?",1,8,Dtr2,#008800,25,Deuteronomist_source.wikitext,2025-08-18T18:16:26.190513
Deuteronomy 9,"Only take heed to thyself, and keep thy soul diligently, lest thou forget the things which thine eyes have seen, and lest they depart from thy heart all the days of thy life: but teach them thy sons, and thy sons' sons;",1,9,Dtr2,#008800,42,Deuteronomist_source.wikitext,2025-08-18T18:16:26.190513
