reference,text,chapter,verse,sub_source,color,word_count,source_file,parsing_date
Deuteronomy 12,For all that do these things are an abomination unto the LORD: and because of these abominations the LORD thy God doth drive them out from before thee.,1,12,Core,#000000,28,Deuteronomist_source.wikitext,2025-08-18T18:16:26.193513
Deuteronomy 13,Thou shalt be perfect with the LORD thy God.,1,13,Core,#000000,9,Deuteronomist_source.wikitext,2025-08-18T18:16:26.193513
Deuteronomy 14,"For these nations, which thou shalt possess, hearkened unto observers of times, and unto diviners: but as for thee, the LORD thy God hath not suffered thee so to do.",1,14,Core,#000000,30,Deuteronomist_source.wikitext,2025-08-18T18:16:26.193513
Deuteronomy 15,"The LORD thy God will raise up unto thee a Prophet from the midst of thee, of thy brethren, like unto me; unto him ye shall hearken;",1,15,Core,#000000,27,Deuteronomist_source.wikitext,2025-08-18T18:16:26.193513
Deuteronomy 16,"According to all that thou desiredst of the LORD thy God in Horeb in the day of the assembly, saying, Let me not hear again the voice of the LORD my God, neither let me see this great fire any more, that I die not.",1,16,Core,#000000,45,Deuteronomist_source.wikitext,2025-08-18T18:16:26.193513
Deuteronomy 17,"And the LORD said unto me, They have well spoken that which they have spoken.",1,17,Core,#000000,15,Deuteronomist_source.wikitext,2025-08-18T18:16:26.193513
Deuteronomy 18,"I will raise them up a Prophet from among their brethren, like unto thee, and will put my words in his mouth; and he shall speak unto them all that I shall command him.",1,18,Core,#000000,34,Deuteronomist_source.wikitext,2025-08-18T18:16:26.193513
Deuteronomy 19,"And it shall come to pass, that whosoever will not hearken unto my words which he shall speak in my name, I will require it of him.",1,19,Core,#000000,27,Deuteronomist_source.wikitext,2025-08-18T18:16:26.193513
Deuteronomy 20,"But the prophet, which shall presume to speak a word in my name, which I have not commanded him to speak, or that shall speak in the name of other gods, even that prophet shall die.",1,20,Core,#000000,36,Deuteronomist_source.wikitext,2025-08-18T18:16:26.193513
Deuteronomy 21,"And if thou say in thine heart, How shall we know the word which the LORD hath not spoken?",1,21,Core,#000000,19,Deuteronomist_source.wikitext,2025-08-18T18:16:26.193513
Deuteronomy 22,"When a prophet speaketh in the name of the LORD, if the thing follow not, nor come to pass, that is the thing which the LORD hath not spoken, but the prophet hath spoken it presumptuously: thou shalt not be afraid of him.",1,22,Core,#000000,43,Deuteronomist_source.wikitext,2025-08-18T18:16:26.193513
Deuteronomy 1,"When the LORD thy God hath cut off the nations, whose land the LORD thy God giveth thee, and thou succeedest them, and dwellest in their cities, and in their houses;",1,1,Core,#000000,31,Deuteronomist_source.wikitext,2025-08-18T18:16:26.193513
Deuteronomy 2,"Thou shalt separate three cities for thee in the midst of thy land, which the LORD thy God giveth thee to possess it.",1,2,Core,#000000,23,Deuteronomist_source.wikitext,2025-08-18T18:16:26.193513
Deuteronomy 3,"Thou shalt prepare thee a way, and divide the coasts of thy land, which the LORD thy God giveth thee to inherit, into three parts, that every slayer may flee thither.",1,3,Core,#000000,31,Deuteronomist_source.wikitext,2025-08-18T18:16:26.193513
Deuteronomy 4,"And this is the case of the slayer, which shall flee thither, that he may live: Whoso killeth his neighbour ignorantly, whom he hated not in time past;",1,4,Core,#000000,28,Deuteronomist_source.wikitext,2025-08-18T18:16:26.193513
Deuteronomy 5,"As when a man goeth into the wood with his neighbour to hew wood, and his hand fetcheth a stroke with the axe to cut down the tree, and the head slippeth from the helve, and lighteth upon his neighbour, that he die; he shall flee unto one of those cities, and live:",1,5,Core,#000000,53,Deuteronomist_source.wikitext,2025-08-18T18:16:26.193513
Deuteronomy 6,"Lest the avenger of the blood pursue the slayer, while his heart is hot, and overtake him, because the way is long, and slay him; whereas he was not worthy of death, inasmuch as he hated him not in time past.",1,6,Core,#000000,41,Deuteronomist_source.wikitext,2025-08-18T18:16:26.193513
Deuteronomy 7,"Wherefore I command thee, saying, Thou shalt separate three cities for thee.",1,7,Core,#000000,12,Deuteronomist_source.wikitext,2025-08-18T18:16:26.193513
Deuteronomy 8,"And if the LORD thy God enlarge thy coast, as he hath sworn unto thy fathers, and give thee all the land which he promised to give unto thy fathers;",1,8,Core,#000000,30,Deuteronomist_source.wikitext,2025-08-18T18:16:26.193513
Deuteronomy 9,"If thou shalt keep all these commandments to do them, which I command thee this day, to love the LORD thy God, and to walk ever in his ways; then shalt thou add three cities more for thee, beside these three:",1,9,Core,#000000,41,Deuteronomist_source.wikitext,2025-08-18T18:16:26.193513
Deuteronomy 10,"That innocent blood be not shed in thy land, which the LORD thy God giveth thee for an inheritance, and so blood be upon thee.",1,10,Core,#000000,25,Deuteronomist_source.wikitext,2025-08-18T18:16:26.193513
Deuteronomy 11,"But if any man hate his neighbour, and lie in wait for him, and rise up against him, and smite him mortally that he die, and fleeth into one of these cities:",1,11,Core,#000000,32,Deuteronomist_source.wikitext,2025-08-18T18:16:26.193513
Deuteronomy 12,"Then the elders of his city shall send and fetch him thence, and deliver him into the hand of the avenger of blood, that he may die.",1,12,Core,#000000,27,Deuteronomist_source.wikitext,2025-08-18T18:16:26.193513
Deuteronomy 13,"Thine eye shall not pity him, but thou shalt put away the guilt of innocent blood from Israel, that it may go well with thee.",1,13,Core,#000000,25,Deuteronomist_source.wikitext,2025-08-18T18:16:26.193513
Deuteronomy 14,"Thou shalt not remove thy neighbour's landmark, which they of old time have set in thine inheritance, which thou shalt inherit in the land that the LORD thy God giveth thee to possess it.",1,14,Core,#000000,34,Deuteronomist_source.wikitext,2025-08-18T18:16:26.193513
Deuteronomy 15,"One witness shall not rise up against a man for any iniquity, or for any sin, in any sin that he sinneth: at the mouth of two witnesses, or at the mouth of three witnesses, shall the matter be established.",1,15,Core,#000000,40,Deuteronomist_source.wikitext,2025-08-18T18:16:26.193513
Deuteronomy 16,If a false witness rise up against any man to testify against him that which is wrong;,1,16,Core,#000000,17,Deuteronomist_source.wikitext,2025-08-18T18:16:26.193513
Deuteronomy 17,"Then both the men, between whom the controversy is, shall stand before the LORD, before the priests and the judges, which shall be in those days;",1,17,Core,#000000,26,Deuteronomist_source.wikitext,2025-08-18T18:16:26.193513
Deuteronomy 18,"And the judges shall make diligent inquisition: and, behold, if the witness be a false witness, and hath testified falsely against his brother;",1,18,Core,#000000,23,Deuteronomist_source.wikitext,2025-08-18T18:16:26.193513
Deuteronomy 19,"Then shall ye do unto him, as he had thought to have done unto his brother: so shalt thou put the evil away from among you.",1,19,Core,#000000,26,Deuteronomist_source.wikitext,2025-08-18T18:16:26.193513
Deuteronomy 20,"And those which remain shall hear, and fear, and shall henceforth commit no more any such evil among you.",1,20,Core,#000000,19,Deuteronomist_source.wikitext,2025-08-18T18:16:26.193513
Deuteronomy 21,"And thine eye shall not pity; but life shall go for life, eye for eye, tooth for tooth, hand for hand, foot for foot.",1,21,Core,#000000,24,Deuteronomist_source.wikitext,2025-08-18T18:16:26.193513
Deuteronomy 1,"When thou goest out to battle against thine enemies, and seest horses, and chariots, and a people more than thou, be not afraid of them: for the LORD thy God is with thee, which brought thee up out of the land of Egypt.",1,1,Core,#000000,43,Deuteronomist_source.wikitext,2025-08-18T18:16:26.193513
Deuteronomy 2,"And it shall be, when ye are come nigh unto the battle, that the priest shall approach and speak unto the people,",1,2,Core,#000000,22,Deuteronomist_source.wikitext,2025-08-18T18:16:26.193513
Deuteronomy 3,"And shall say unto them, Hear, O Israel, ye approach this day unto battle against your enemies: let not your hearts faint, fear not, and do not tremble, neither be ye terrified because of them;",1,3,Core,#000000,35,Deuteronomist_source.wikitext,2025-08-18T18:16:26.193513
Deuteronomy 4,"For the LORD your God is he that goeth with you, to fight for you against your enemies, to save you.",1,4,Core,#000000,21,Deuteronomist_source.wikitext,2025-08-18T18:16:26.193513
Deuteronomy 5,"And the officers shall speak unto the people, saying, What man is there that hath built a new house, and hath not dedicated it? let him go and return to his house, lest he die in the battle, and another man dedicate it.",1,5,Core,#000000,43,Deuteronomist_source.wikitext,2025-08-18T18:16:26.193513
Deuteronomy 6,"And what man is he that hath planted a vineyard, and hath not yet eaten of it? let him also go and return unto his house, lest he die in the battle, and another man eat of it.",1,6,Core,#000000,38,Deuteronomist_source.wikitext,2025-08-18T18:16:26.193513
Deuteronomy 7,"And what man is there that hath betrothed a wife, and hath not taken her? let him go and return unto his house, lest he die in the battle, and another man take her.",1,7,Core,#000000,34,Deuteronomist_source.wikitext,2025-08-18T18:16:26.193513
Deuteronomy 8,"And the officers shall speak further unto the people, and they shall say, What man is there that is fearful and fainthearted? let him go and return unto his house, lest his brethren's heart faint as well as his heart.",1,8,Core,#000000,40,Deuteronomist_source.wikitext,2025-08-18T18:16:26.193513
Deuteronomy 9,"And it shall be, when the officers have made an end of speaking unto the people that they shall make captains of the armies to lead the people.",1,9,Core,#000000,28,Deuteronomist_source.wikitext,2025-08-18T18:16:26.193513
Deuteronomy 10,"When thou comest nigh unto a city to fight against it, then proclaim peace unto it.",1,10,Core,#000000,16,Deuteronomist_source.wikitext,2025-08-18T18:16:26.193513
Deuteronomy 11,"And it shall be, if it make thee answer of peace, and open unto thee, then it shall be, that all the people that is found therein shall be tributaries unto thee, and they shall serve thee.",1,11,Core,#000000,37,Deuteronomist_source.wikitext,2025-08-18T18:16:26.193513
Deuteronomy 12,"And if it will make no peace with thee, but will make war against thee, then thou shalt besiege it:",1,12,Core,#000000,20,Deuteronomist_source.wikitext,2025-08-18T18:16:26.193513
Deuteronomy 13,"And when the LORD thy God hath delivered it into thine hands, thou shalt smite every male thereof with the edge of the sword:",1,13,Core,#000000,24,Deuteronomist_source.wikitext,2025-08-18T18:16:26.193513
Deuteronomy 14,"But the women, and the little ones, and the cattle, and all that is in the city, even all the spoil thereof, shalt thou take unto thyself; and thou shalt eat the spoil of thine enemies, which the LORD thy God hath given thee.",1,14,Core,#000000,44,Deuteronomist_source.wikitext,2025-08-18T18:16:26.193513
Deuteronomy 15,"Thus shalt thou do unto all the cities which are very far off from thee, which are not of the cities of these nations.",1,15,Core,#000000,24,Deuteronomist_source.wikitext,2025-08-18T18:16:26.193513
Deuteronomy 16,"But of the cities of these people, which the LORD thy God doth give thee for an inheritance, thou shalt save alive nothing that breatheth:",1,16,Core,#000000,25,Deuteronomist_source.wikitext,2025-08-18T18:16:26.194513
Deuteronomy 17,"But thou shalt utterly destroy them; namely, the Hittites, and the Amorites, the Canaanites, and the Perizzites, the Hivites, and the Jebusites; as the LORD thy God hath commanded thee:",1,17,Core,#000000,30,Deuteronomist_source.wikitext,2025-08-18T18:16:26.194513
Deuteronomy 18,"That they teach you not to do after all their abominations, which they have done unto their gods; so should ye sin against the LORD your God.",1,18,Core,#000000,27,Deuteronomist_source.wikitext,2025-08-18T18:16:26.194513
Deuteronomy 19,"When thou shalt besiege a city a long time, in making war against it to take it, thou shalt not destroy the trees thereof by forcing an axe against them: for thou mayest eat of them, and thou shalt not cut them down (for the tree of the field is man's life) to employ them in the siege:",1,19,Core,#000000,58,Deuteronomist_source.wikitext,2025-08-18T18:16:26.194513
Deuteronomy 20,"Only the trees which thou knowest that they be not trees for meat, thou shalt destroy and cut them down; and thou shalt build bulwarks against the city that maketh war with thee, until it be subdued.",1,20,Core,#000000,37,Deuteronomist_source.wikitext,2025-08-18T18:16:26.194513
Deuteronomy 1,"If one be found slain in the land which the LORD thy God giveth thee to possess it, lying in the field, and it be not known who hath slain him:",1,1,Core,#000000,31,Deuteronomist_source.wikitext,2025-08-18T18:16:26.194513
Deuteronomy 2,"Then thy elders and thy judges shall come forth, and they shall measure unto the cities which are round about him that is slain:",1,2,Core,#000000,24,Deuteronomist_source.wikitext,2025-08-18T18:16:26.194513
Deuteronomy 3,"And it shall be, that the city which is next unto the slain man, even the elders of that city shall take an heifer, which hath not been wrought with, and which hath not drawn in the yoke;",1,3,Core,#000000,38,Deuteronomist_source.wikitext,2025-08-18T18:16:26.194513
Deuteronomy 4,"And the elders of that city shall bring down the heifer unto a rough valley, which is neither eared nor sown, and shall strike off the heifer's neck there in the valley:",1,4,Core,#000000,32,Deuteronomist_source.wikitext,2025-08-18T18:16:26.194513
Deuteronomy 5,"And the priests the sons of Levi shall come near; for them the LORD thy God hath chosen to minister unto him, and to bless in the name of the LORD; and by their word shall every controversy and every stroke be tried:",1,5,Core,#000000,43,Deuteronomist_source.wikitext,2025-08-18T18:16:26.194513
Deuteronomy 6,"And all the elders of that city, that are next unto the slain man, shall wash their hands over the heifer that is beheaded in the valley:",1,6,Core,#000000,27,Deuteronomist_source.wikitext,2025-08-18T18:16:26.194513
Deuteronomy 7,"And they shall answer and say, Our hands have not shed this blood, neither have our eyes seen it.",1,7,Core,#000000,19,Deuteronomist_source.wikitext,2025-08-18T18:16:26.194513
Deuteronomy 8,"Be merciful, O LORD, unto thy people Israel, whom thou hast redeemed, and lay not innocent blood unto thy people of Israel's charge. And the blood shall be forgiven them.",1,8,Core,#000000,30,Deuteronomist_source.wikitext,2025-08-18T18:16:26.194513
Deuteronomy 9,"So shalt thou put away the guilt of innocent blood from among you, when thou shalt do that which is right in the sight of the LORD.",1,9,Core,#000000,27,Deuteronomist_source.wikitext,2025-08-18T18:16:26.194513
Deuteronomy 10,"When thou goest forth to war against thine enemies, and the LORD thy God hath delivered them into thine hands, and thou hast taken them captive,",1,10,Core,#000000,26,Deuteronomist_source.wikitext,2025-08-18T18:16:26.194513
Deuteronomy 11,"And seest among the captives a beautiful woman, and hast a desire unto her, that thou wouldest have her to thy wife;",1,11,Core,#000000,22,Deuteronomist_source.wikitext,2025-08-18T18:16:26.194513
Deuteronomy 12,"Then thou shalt bring her home to thine house, and she shall shave her head, and pare her nails;",1,12,Core,#000000,19,Deuteronomist_source.wikitext,2025-08-18T18:16:26.194513
Deuteronomy 13,"And she shall put the raiment of her captivity from off her, and shall remain in thine house, and bewail her father and her mother a full month: and after that thou shalt go in unto her, and be her husband, and she shall be thy wife.",1,13,Core,#000000,47,Deuteronomist_source.wikitext,2025-08-18T18:16:26.194513
Deuteronomy 14,"And it shall be, if thou have no delight in her, then thou shalt let her go whither she will; but thou shalt not sell her at all for money, thou shalt not make merchandise of her, because thou hast humbled her.",1,14,Core,#000000,42,Deuteronomist_source.wikitext,2025-08-18T18:16:26.194513
Deuteronomy 15,"If a man have two wives, one beloved, and another hated, and they have born him children, both the beloved and the hated; and if the firstborn son be hers that was hated:",1,15,Core,#000000,33,Deuteronomist_source.wikitext,2025-08-18T18:16:26.194513
Deuteronomy 16,"Then it shall be, when he maketh his sons to inherit that which he hath, that he may not make the son of the beloved firstborn before the son of the hated, which is indeed the firstborn:",1,16,Core,#000000,37,Deuteronomist_source.wikitext,2025-08-18T18:16:26.194513
Deuteronomy 17,"But he shall acknowledge the son of the hated for the firstborn, by giving him a double portion of all that he hath: for he is the beginning of his strength; the right of the firstborn is his.",1,17,Core,#000000,38,Deuteronomist_source.wikitext,2025-08-18T18:16:26.194513
Deuteronomy 18,"If a man have a stubborn and rebellious son, which will not obey the voice of his father, or the voice of his mother, and that, when they have chastened him, will not hearken unto them:",1,18,Core,#000000,36,Deuteronomist_source.wikitext,2025-08-18T18:16:26.194513
Deuteronomy 19,"Then shall his father and his mother lay hold on him, and bring him out unto the elders of his city, and unto the gate of his place;",1,19,Core,#000000,28,Deuteronomist_source.wikitext,2025-08-18T18:16:26.194513
Deuteronomy 20,"And they shall say unto the elders of his city, This our son is stubborn and rebellious, he will not obey our voice; he is a glutton, and a drunkard.",1,20,Core,#000000,30,Deuteronomist_source.wikitext,2025-08-18T18:16:26.194513
Deuteronomy 21,"And all the men of his city shall stone him with stones, that he die: so shalt thou put evil away from among you; and all Israel shall hear, and fear.",1,21,Core,#000000,31,Deuteronomist_source.wikitext,2025-08-18T18:16:26.194513
Deuteronomy 22,"And if a man have committed a sin worthy of death, and he be to be put to death, and thou hang him on a tree:",1,22,Core,#000000,26,Deuteronomist_source.wikitext,2025-08-18T18:16:26.194513
Deuteronomy 23,"His body shall not remain all night upon the tree, but thou shalt in any wise bury him that day; (for he that is hanged is accursed of God;) that thy land be not defiled, which the LORD thy God giveth thee for an inheritance.",1,23,Core,#000000,45,Deuteronomist_source.wikitext,2025-08-18T18:16:26.194513
Deuteronomy 1,"Thou shalt not see thy brother's ox or his sheep go astray, and hide thyself from them: thou shalt in any case bring them again unto thy brother.",1,1,Core,#000000,28,Deuteronomist_source.wikitext,2025-08-18T18:16:26.194513
Deuteronomy 2,"And if thy brother be not nigh unto thee, or if thou know him not, then thou shalt bring it unto thine own house, and it shall be with thee until thy brother seek after it, and thou shalt restore it to him again.",1,2,Core,#000000,44,Deuteronomist_source.wikitext,2025-08-18T18:16:26.194513
Deuteronomy 3,"In like manner shalt thou do with his ass; and so shalt thou do with his raiment; and with all lost thing of thy brother's, which he hath lost, and thou hast found, shalt thou do likewise: thou mayest not hide thyself.",1,3,Core,#000000,42,Deuteronomist_source.wikitext,2025-08-18T18:16:26.194513
Deuteronomy 4,"Thou shalt not see thy brother's ass or his ox fall down by the way, and hide thyself from them: thou shalt surely help him to lift them up again.",1,4,Core,#000000,30,Deuteronomist_source.wikitext,2025-08-18T18:16:26.194513
Deuteronomy 5,"The woman shall not wear that which pertaineth unto a man, neither shall a man put on a woman's garment: for all that do so are abomination unto the LORD thy God.",1,5,Core,#000000,32,Deuteronomist_source.wikitext,2025-08-18T18:16:26.194513
Deuteronomy 6,"If a bird's nest chance to be before thee in the way in any tree, or on the ground, whether they be young ones, or eggs, and the dam sitting upon the young, or upon the eggs, thou shalt not take the dam with the young:",1,6,Core,#000000,46,Deuteronomist_source.wikitext,2025-08-18T18:16:26.194513
Deuteronomy 7,"But thou shalt in any wise let the dam go, and take the young to thee; that it may be well with thee, and that thou mayest prolong thy days.",1,7,Core,#000000,30,Deuteronomist_source.wikitext,2025-08-18T18:16:26.194513
Deuteronomy 8,"When thou buildest a new house, then thou shalt make a battlement for thy roof, that thou bring not blood upon thine house, if any man fall from thence.",1,8,Core,#000000,29,Deuteronomist_source.wikitext,2025-08-18T18:16:26.194513
Deuteronomy 9,"Thou shalt not sow thy vineyard with divers seeds: lest the fruit of thy seed which thou hast sown, and the fruit of thy vineyard, be defiled.",1,9,Core,#000000,27,Deuteronomist_source.wikitext,2025-08-18T18:16:26.194513
Deuteronomy 10,Thou shalt not plow with an ox and an ass together.,1,10,Core,#000000,11,Deuteronomist_source.wikitext,2025-08-18T18:16:26.194513
Deuteronomy 11,"Thou shalt not wear a garment of divers sorts, as of woollen and linen together.",1,11,Core,#000000,15,Deuteronomist_source.wikitext,2025-08-18T18:16:26.194513
Deuteronomy 12,"Thou shalt make thee fringes upon the four quarters of thy vesture, wherewith thou coverest thyself.",1,12,Core,#000000,16,Deuteronomist_source.wikitext,2025-08-18T18:16:26.194513
Deuteronomy 13,"If any man take a wife, and go in unto her, and hate her,",1,13,Core,#000000,14,Deuteronomist_source.wikitext,2025-08-18T18:16:26.194513
Deuteronomy 14,"And give occasions of speech against her, and bring up an evil name upon her, and say, I took this woman, and when I came to her, I found her not a maid:",1,14,Core,#000000,33,Deuteronomist_source.wikitext,2025-08-18T18:16:26.194513
Deuteronomy 15,"Then shall the father of the damsel, and her mother, take and bring forth the tokens of the damsel's virginity unto the elders of the city in the gate:",1,15,Core,#000000,29,Deuteronomist_source.wikitext,2025-08-18T18:16:26.194513
Deuteronomy 16,"And the damsel's father shall say unto the elders, I gave my daughter unto this man to wife, and he hateth her;",1,16,Core,#000000,22,Deuteronomist_source.wikitext,2025-08-18T18:16:26.194513
Deuteronomy 17,"And, lo, he hath given occasions of speech against her, saying, I found not thy daughter a maid; and yet these are the tokens of my daughter's virginity. And they shall spread the cloth before the elders of the city.",1,17,Core,#000000,40,Deuteronomist_source.wikitext,2025-08-18T18:16:26.194513
Deuteronomy 18,And the elders of that city shall take that man and chastise him;,1,18,Core,#000000,13,Deuteronomist_source.wikitext,2025-08-18T18:16:26.194513
Deuteronomy 19,"And they shall amerce him in an hundred shekels of silver, and give them unto the father of the damsel, because he hath brought up an evil name upon a virgin of Israel: and she shall be his wife; he may not put her away all his days.",1,19,Core,#000000,48,Deuteronomist_source.wikitext,2025-08-18T18:16:26.194513
Deuteronomy 20,"But if this thing be true, and the tokens of virginity be not found for the damsel:",1,20,Core,#000000,17,Deuteronomist_source.wikitext,2025-08-18T18:16:26.194513
Deuteronomy 21,"Then they shall bring out the damsel to the door of her father's house, and the men of her city shall stone her with stones that she die: because she hath wrought folly in Israel, to play the whore in her father's house: so shalt thou put evil away from among you.",1,21,Core,#000000,52,Deuteronomist_source.wikitext,2025-08-18T18:16:26.194513
Deuteronomy 22,"If a man be found lying with a woman married to an husband, then they shall both of them die, both the man that lay with the woman, and the woman: so shalt thou put away evil from Israel.",1,22,Core,#000000,39,Deuteronomist_source.wikitext,2025-08-18T18:16:26.194513
Deuteronomy 23,"If a damsel that is a virgin be betrothed unto an husband, and a man find her in the city, and lie with her;",1,23,Core,#000000,24,Deuteronomist_source.wikitext,2025-08-18T18:16:26.194513
Deuteronomy 24,"Then ye shall bring them both out unto the gate of that city, and ye shall stone them with stones that they die; the damsel, because she cried not, being in the city; and the man, because he hath humbled his neighbour's wife: so thou shalt put away evil from among you.",1,24,Core,#000000,52,Deuteronomist_source.wikitext,2025-08-18T18:16:26.194513
Deuteronomy 25,"But if a man find a betrothed damsel in the field, and the man force her, and lie with her: then the man only that lay with her shall die.",1,25,Core,#000000,30,Deuteronomist_source.wikitext,2025-08-18T18:16:26.194513
Deuteronomy 26,"But unto the damsel thou shalt do nothing; there is in the damsel no sin worthy of death: for as when a man riseth against his neighbour, and slayeth him, even so is this matter:",1,26,Core,#000000,35,Deuteronomist_source.wikitext,2025-08-18T18:16:26.194513
Deuteronomy 27,"For he found her in the field, and the betrothed damsel cried, and there was none to save her.",1,27,Core,#000000,19,Deuteronomist_source.wikitext,2025-08-18T18:16:26.194513
Deuteronomy 28,"If a man find a damsel that is a virgin, which is not betrothed, and lay hold on her, and lie with her, and they be found;",1,28,Core,#000000,27,Deuteronomist_source.wikitext,2025-08-18T18:16:26.194513
