reference,text,chapter,verse,sub_source,color,word_count,source_file,parsing_date
Deuteronomy 2,"For thou art an holy people unto the LORD thy God, and the LORD hath chosen thee to be a peculiar people unto himself, above all the nations that are upon the earth.",1,2,Core,#000000,33,Deuteronomist_source.wikitext,2025-08-18T18:16:26.191513
Deuteronomy 3,Thou shalt not eat any abominable thing.,1,3,Core,#000000,7,Deuteronomist_source.wikitext,2025-08-18T18:16:26.191513
Deuteronomy 4,"These are the beasts which ye shall eat: the ox, the sheep, and the goat,",1,4,Core,#000000,15,Deuteronomist_source.wikitext,2025-08-18T18:16:26.191513
Deuteronomy 5,"The hart, and the roebuck, and the fallow deer, and the wild goat, and the pygarg, and the wild ox, and the chamois.",1,5,Core,#000000,23,Deuteronomist_source.wikitext,2025-08-18T18:16:26.191513
Deuteronomy 6,"And every beast that parteth the hoof, and cleaveth the cleft into two claws, and cheweth the cud among the beasts, that ye shall eat.",1,6,Core,#000000,25,Deuteronomist_source.wikitext,2025-08-18T18:16:26.191513
Deuteronomy 7,"Nevertheless these ye shall not eat of them that chew the cud, or of them that divide the cloven hoof; as the camel, and the hare, and the coney: for they chew the cud, but divide not the hoof; therefore they are unclean unto you.",1,7,Core,#000000,45,Deuteronomist_source.wikitext,2025-08-18T18:16:26.191513
Deuteronomy 8,"And the swine, because it divideth the hoof, yet cheweth not the cud, it is unclean unto you: ye shall not eat of their flesh, nor touch their dead carcase.",1,8,Core,#000000,30,Deuteronomist_source.wikitext,2025-08-18T18:16:26.191513
Deuteronomy 9,These ye shall eat of all that are in the waters: all that have fins and scales shall ye eat:,1,9,Core,#000000,20,Deuteronomist_source.wikitext,2025-08-18T18:16:26.191513
Deuteronomy 10,And whatsoever hath not fins and scales ye may not eat; it is unclean unto you.,1,10,Core,#000000,16,Deuteronomist_source.wikitext,2025-08-18T18:16:26.191513
Deuteronomy 11,Of all clean birds ye shall eat.,1,11,Core,#000000,7,Deuteronomist_source.wikitext,2025-08-18T18:16:26.191513
Deuteronomy 12,"But these are they of which ye shall not eat: the eagle, and the ossifrage, and the ospray,",1,12,Core,#000000,18,Deuteronomist_source.wikitext,2025-08-18T18:16:26.191513
Deuteronomy 13,"And the glede, and the kite, and the vulture after his kind,",1,13,Core,#000000,12,Deuteronomist_source.wikitext,2025-08-18T18:16:26.191513
Deuteronomy 14,"And every raven after his kind,",1,14,Core,#000000,6,Deuteronomist_source.wikitext,2025-08-18T18:16:26.191513
Deuteronomy 15,"And the owl, and the night hawk, and the cuckow, and the hawk after his kind,",1,15,Core,#000000,16,Deuteronomist_source.wikitext,2025-08-18T18:16:26.191513
Deuteronomy 16,"The little owl, and the great owl, and the swan,",1,16,Core,#000000,10,Deuteronomist_source.wikitext,2025-08-18T18:16:26.191513
Deuteronomy 17,"And the pelican, and the gier eagle, and the cormorant,",1,17,Core,#000000,10,Deuteronomist_source.wikitext,2025-08-18T18:16:26.191513
Deuteronomy 18,"And the stork, and the heron after her kind, and the lapwing, and the bat.",1,18,Core,#000000,15,Deuteronomist_source.wikitext,2025-08-18T18:16:26.191513
Deuteronomy 19,And every creeping thing that flieth is unclean unto you: they shall not be eaten.,1,19,Core,#000000,15,Deuteronomist_source.wikitext,2025-08-18T18:16:26.191513
Deuteronomy 20,But of all clean fowls ye may eat.,1,20,Core,#000000,8,Deuteronomist_source.wikitext,2025-08-18T18:16:26.191513
Deuteronomy 21,"Ye shall not eat of anything that dieth of itself: thou shalt give it unto the stranger that is in thy gates, that he may eat it; or thou mayest sell it unto an alien: for thou art an holy people unto the LORD thy God. Thou shalt not seethe a kid in his mother's milk.",1,21,Core,#000000,56,Deuteronomist_source.wikitext,2025-08-18T18:16:26.191513
Deuteronomy 22,"Thou shalt truly tithe all the increase of thy seed, that the field bringeth forth year by year.",1,22,Core,#000000,18,Deuteronomist_source.wikitext,2025-08-18T18:16:26.191513
Deuteronomy 23,"And thou shalt eat before the LORD thy God, in the place which he shall choose to place his name there, the tithe of thy corn, of thy wine, and of thine oil, and the firstlings of thy herds and of thy flocks; that thou mayest learn to fear the LORD thy God always.",1,23,Core,#000000,54,Deuteronomist_source.wikitext,2025-08-18T18:16:26.191513
Deuteronomy 24,"And if the way be too long for thee, so that thou art not able to carry it; or if the place be too far from thee, which the LORD thy God shall choose to set his name there, when the LORD thy God hath blessed thee:",1,24,Core,#000000,47,Deuteronomist_source.wikitext,2025-08-18T18:16:26.191513
Deuteronomy 25,"Then shalt thou turn it into money, and bind up the money in thine hand, and shalt go unto the place which the LORD thy God shall choose:",1,25,Core,#000000,28,Deuteronomist_source.wikitext,2025-08-18T18:16:26.191513
Deuteronomy 26,"And thou shalt bestow that money for whatsoever thy soul lusteth after, for oxen, or for sheep, or for wine, or for strong drink, or for whatsoever thy soul desireth: and thou shalt eat there before the LORD thy God, and thou shalt rejoice, thou, and thine household,",1,26,Core,#000000,48,Deuteronomist_source.wikitext,2025-08-18T18:16:26.191513
Deuteronomy 27,And the Levite that is within thy gates; thou shalt not forsake him; for he hath no part nor inheritance with thee.,1,27,Core,#000000,22,Deuteronomist_source.wikitext,2025-08-18T18:16:26.191513
Deuteronomy 28,"At the end of three years thou shalt bring forth all the tithe of thine increase the same year, and shalt lay it up within thy gates:",1,28,Core,#000000,27,Deuteronomist_source.wikitext,2025-08-18T18:16:26.191513
Deuteronomy 29,"And the Levite, (because he hath no part nor inheritance with thee,) and the stranger, and the fatherless, and the widow, which are within thy gates, shall come, and shall eat and be satisfied; that the LORD thy God may bless thee in all the work of thine hand which thou doest.",1,29,Core,#000000,52,Deuteronomist_source.wikitext,2025-08-18T18:16:26.191513
Deuteronomy 1,At the end of every seven years thou shalt make a release.,1,1,Core,#000000,12,Deuteronomist_source.wikitext,2025-08-18T18:16:26.191513
Deuteronomy 2,"And this is the manner of the release: Every creditor that lendeth ought unto his neighbour shall release it; he shall not exact it of his neighbour, or of his brother; because it is called the LORD's release.",1,2,Core,#000000,38,Deuteronomist_source.wikitext,2025-08-18T18:16:26.191513
Deuteronomy 3,Of a foreigner thou mayest exact it again: but that which is thine with thy brother thine hand shall release;,1,3,Core,#000000,20,Deuteronomist_source.wikitext,2025-08-18T18:16:26.191513
Deuteronomy 4,Save when there shall be no poor among you; for the LORD shall greatly bless thee in the land which the LORD thy God giveth thee for an inheritance to possess it:,1,4,Core,#000000,32,Deuteronomist_source.wikitext,2025-08-18T18:16:26.191513
Deuteronomy 5,"Only if thou carefully hearken unto the voice of the LORD thy God, to observe to do all these commandments which I command thee this day.",1,5,Core,#000000,26,Deuteronomist_source.wikitext,2025-08-18T18:16:26.191513
Deuteronomy 6,"For the LORD thy God blesseth thee, as he promised thee: and thou shalt lend unto many nations, but thou shalt not borrow; and thou shalt reign over many nations, but they shall not reign over thee.",1,6,Core,#000000,37,Deuteronomist_source.wikitext,2025-08-18T18:16:26.191513
Deuteronomy 7,"If there be among you a poor man of one of thy brethren within any of thy gates in thy land which the LORD thy God giveth thee, thou shalt not harden thine heart, nor shut thine hand from thy poor brother:",1,7,Core,#000000,42,Deuteronomist_source.wikitext,2025-08-18T18:16:26.191513
Deuteronomy 8,"But thou shalt open thine hand wide unto him, and shalt surely lend him sufficient for his need, in that which he wanteth.",1,8,Core,#000000,23,Deuteronomist_source.wikitext,2025-08-18T18:16:26.191513
Deuteronomy 9,"Beware that there be not a thought in thy wicked heart, saying, The seventh year, the year of release, is at hand; and thine eye be evil against thy poor brother, and thou givest him nought; and he cry unto the LORD against thee, and it be sin unto thee.",1,9,Core,#000000,50,Deuteronomist_source.wikitext,2025-08-18T18:16:26.191513
Deuteronomy 10,"Thou shalt surely give him, and thine heart shall not be grieved when thou givest unto him: because that for this thing the LORD thy God shall bless thee in all thy works, and in all that thou puttest thine hand unto.",1,10,Core,#000000,42,Deuteronomist_source.wikitext,2025-08-18T18:16:26.191513
Deuteronomy 11,"For the poor shall never cease out of the land: therefore I command thee, saying, Thou shalt open thine hand wide unto thy brother, to thy poor, and to thy needy, in thy land.",1,11,Core,#000000,34,Deuteronomist_source.wikitext,2025-08-18T18:16:26.191513
Deuteronomy 12,"And if thy brother, an Hebrew man, or an Hebrew woman, be sold unto thee, and serve thee six years; then in the seventh year thou shalt let him go free from thee.",1,12,Core,#000000,33,Deuteronomist_source.wikitext,2025-08-18T18:16:26.191513
Deuteronomy 13,"And when thou sendest him out free from thee, thou shalt not let him go away empty:",1,13,Core,#000000,17,Deuteronomist_source.wikitext,2025-08-18T18:16:26.191513
Deuteronomy 14,"Thou shalt furnish him liberally out of thy flock, and out of thy floor, and out of thy winepress: of that wherewith the LORD thy God hath blessed thee thou shalt give unto him.",1,14,Core,#000000,34,Deuteronomist_source.wikitext,2025-08-18T18:16:26.191513
Deuteronomy 15,"And thou shalt remember that thou wast a bondman in the land of Egypt, and the LORD thy God redeemed thee: therefore I command thee this thing to day.",1,15,Core,#000000,29,Deuteronomist_source.wikitext,2025-08-18T18:16:26.191513
Deuteronomy 16,"And it shall be, if he say unto thee, I will not go away from thee; because he loveth thee and thine house, because he is well with thee;",1,16,Core,#000000,29,Deuteronomist_source.wikitext,2025-08-18T18:16:26.191513
Deuteronomy 17,"Then thou shalt take an aul, and thrust it through his ear unto the door, and he shall be thy servant for ever. And also unto thy maidservant thou shalt do likewise.",1,17,Core,#000000,32,Deuteronomist_source.wikitext,2025-08-18T18:16:26.191513
Deuteronomy 18,"It shall not seem hard unto thee, when thou sendest him away free from thee; for he hath been worth a double hired servant to thee, in serving thee six years: and the LORD thy God shall bless thee in all that thou doest.",1,18,Core,#000000,44,Deuteronomist_source.wikitext,2025-08-18T18:16:26.191513
Deuteronomy 19,"All the firstling males that come of thy herd and of thy flock thou shalt sanctify unto the LORD thy God: thou shalt do no work with the firstling of thy bullock, nor shear the firstling of thy sheep.",1,19,Core,#000000,39,Deuteronomist_source.wikitext,2025-08-18T18:16:26.191513
Deuteronomy 20,"Thou shalt eat it before the LORD thy God year by year in the place which the LORD shall choose, thou and thy household.",1,20,Core,#000000,24,Deuteronomist_source.wikitext,2025-08-18T18:16:26.191513
Deuteronomy 21,"And if there be any blemish therein, as if it be lame, or blind, or have any ill blemish, thou shalt not sacrifice it unto the LORD thy God.",1,21,Core,#000000,29,Deuteronomist_source.wikitext,2025-08-18T18:16:26.191513
Deuteronomy 22,"Thou shalt eat it within thy gates: the unclean and the clean person shall eat it alike, as the roebuck, and as the hart.",1,22,Core,#000000,24,Deuteronomist_source.wikitext,2025-08-18T18:16:26.191513
Deuteronomy 23,Only thou shalt not eat the blood thereof; thou shalt pour it upon the ground as water.,1,23,Core,#000000,17,Deuteronomist_source.wikitext,2025-08-18T18:16:26.191513
Deuteronomy 1,"Observe the month of Abib, and keep the passover unto the LORD thy God: for in the month of Abib the LORD thy God brought thee forth out of Egypt by night.",1,1,Core,#000000,32,Deuteronomist_source.wikitext,2025-08-18T18:16:26.191513
Deuteronomy 2,"Thou shalt therefore sacrifice the passover unto the LORD thy God, of the flock and the herd, in the place which the LORD shall choose to place his name there.",1,2,Core,#000000,30,Deuteronomist_source.wikitext,2025-08-18T18:16:26.191513
Deuteronomy 3,"Thou shalt eat no leavened bread with it; seven days shalt thou eat unleavened bread therewith, even the bread of affliction; for thou camest forth out of the land of Egypt in haste: that thou mayest remember the day when thou camest forth out of the land of Egypt all the days of thy life.",1,3,Core,#000000,55,Deuteronomist_source.wikitext,2025-08-18T18:16:26.191513
Deuteronomy 4,"And there shall be no leavened bread seen with thee in all thy coast seven days; neither shall there any thing of the flesh, which thou sacrificedst the first day at even, remain all night until the morning.",1,4,Core,#000000,38,Deuteronomist_source.wikitext,2025-08-18T18:16:26.191513
Deuteronomy 5,"Thou mayest not sacrifice the passover within any of thy gates, which the LORD thy God giveth thee:",1,5,Core,#000000,18,Deuteronomist_source.wikitext,2025-08-18T18:16:26.191513
Deuteronomy 6,"But at the place which the LORD thy God shall choose to place his name in, there thou shalt sacrifice the passover at even, at the going down of the sun, at the season that thou camest forth out of Egypt.",1,6,Core,#000000,41,Deuteronomist_source.wikitext,2025-08-18T18:16:26.191513
Deuteronomy 7,"And thou shalt roast and eat it in the place which the LORD thy God shall choose: and thou shalt turn in the morning, and go unto thy tents.",1,7,Core,#000000,29,Deuteronomist_source.wikitext,2025-08-18T18:16:26.191513
Deuteronomy 8,Six days thou shalt eat unleavened bread: and on the seventh day shall be a solemn assembly to the LORD thy God: thou shalt do no work therein.,1,8,Core,#000000,28,Deuteronomist_source.wikitext,2025-08-18T18:16:26.191513
Deuteronomy 9,Seven weeks shalt thou number unto thee: begin to number the seven weeks from such time as thou beginnest to put the sickle to the corn.,1,9,Core,#000000,26,Deuteronomist_source.wikitext,2025-08-18T18:16:26.191513
Deuteronomy 10,"And thou shalt keep the feast of weeks unto the LORD thy God with a tribute of a freewill offering of thine hand, which thou shalt give unto the LORD thy God, according as the LORD thy God hath blessed thee:",1,10,Core,#000000,41,Deuteronomist_source.wikitext,2025-08-18T18:16:26.191513
Deuteronomy 11,"And thou shalt rejoice before the LORD thy God, thou, and thy son, and thy daughter, and thy manservant, and thy maidservant, and the Levite that is within thy gates, and the stranger, and the fatherless, and the widow, that are among you, in the place which the LORD thy God hath chosen to place his name there.",1,11,Core,#000000,58,Deuteronomist_source.wikitext,2025-08-18T18:16:26.191513
Deuteronomy 12,And thou shalt remember that thou wast a bondman in Egypt: and thou shalt observe and do these statutes.,1,12,Core,#000000,19,Deuteronomist_source.wikitext,2025-08-18T18:16:26.191513
Deuteronomy 13,"Thou shalt observe the feast of tabernacles seven days, after that thou hast gathered in thy corn and thy wine:",1,13,Core,#000000,20,Deuteronomist_source.wikitext,2025-08-18T18:16:26.191513
Deuteronomy 14,"And thou shalt rejoice in thy feast, thou, and thy son, and thy daughter, and thy manservant, and thy maidservant, and the Levite, the stranger, and the fatherless, and the widow, that are within thy gates.",1,14,Core,#000000,36,Deuteronomist_source.wikitext,2025-08-18T18:16:26.191513
Deuteronomy 15,"Seven days shalt thou keep a solemn feast unto the LORD thy God in the place which the LORD shall choose: because the LORD thy God shall bless thee in all thine increase, and in all the works of thine hands, therefore thou shalt surely rejoice.",1,15,Core,#000000,46,Deuteronomist_source.wikitext,2025-08-18T18:16:26.191513
Deuteronomy 16,"Three times in a year shall all thy males appear before the LORD thy God in the place which he shall choose; in the feast of unleavened bread, and in the feast of weeks, and in the feast of tabernacles: and they shall not appear before the LORD empty:",1,16,Core,#000000,49,Deuteronomist_source.wikitext,2025-08-18T18:16:26.191513
Deuteronomy 17,"Every man shall give as he is able, according to the blessing of the LORD thy God which he hath given thee.",1,17,Core,#000000,22,Deuteronomist_source.wikitext,2025-08-18T18:16:26.191513
Deuteronomy 18,"Judges and officers shalt thou make thee in all thy gates, which the LORD thy God giveth thee, throughout thy tribes: and they shall judge the people with just judgment.",1,18,Core,#000000,30,Deuteronomist_source.wikitext,2025-08-18T18:16:26.191513
Deuteronomy 19,"Thou shalt not wrest judgment; thou shalt not respect persons, neither take a gift: for a gift doth blind the eyes of the wise, and pervert the words of the righteous.",1,19,Core,#000000,31,Deuteronomist_source.wikitext,2025-08-18T18:16:26.191513
Deuteronomy 20,"That which is altogether just shalt thou follow, that thou mayest live, and inherit the land which the LORD thy God giveth thee.",1,20,Core,#000000,23,Deuteronomist_source.wikitext,2025-08-18T18:16:26.191513
Deuteronomy 21,"Thou shalt not plant thee a grove of any trees near unto the altar of the LORD thy God, which thou shalt make thee.",1,21,Core,#000000,24,Deuteronomist_source.wikitext,2025-08-18T18:16:26.191513
Deuteronomy 22,Neither shalt thou set thee up any image; which the LORD thy God hateth.,1,22,Core,#000000,14,Deuteronomist_source.wikitext,2025-08-18T18:16:26.191513
Deuteronomy 1,"Thou shalt not sacrifice unto the LORD thy God any bullock, or sheep, wherein is blemish, or any evilfavouredness: for that is an abomination unto the LORD thy God.",1,1,Core,#000000,29,Deuteronomist_source.wikitext,2025-08-18T18:16:26.191513
Deuteronomy 2,"If there be found among you, within any of thy gates which the LORD thy God giveth thee, man or woman, that hath wrought wickedness in the sight of the LORD thy God, in transgressing his covenant,",1,2,Core,#000000,37,Deuteronomist_source.wikitext,2025-08-18T18:16:26.191513
Deuteronomy 3,"And hath gone and served other gods, and worshipped them, either the sun, or moon, or any of the host of heaven, which I have not commanded;",1,3,Core,#000000,27,Deuteronomist_source.wikitext,2025-08-18T18:16:26.191513
Deuteronomy 4,"And it be told thee, and thou hast heard of it, and enquired diligently, and, behold, it be true, and the thing certain, that such abomination is wrought in Israel:",1,4,Core,#000000,30,Deuteronomist_source.wikitext,2025-08-18T18:16:26.191513
Deuteronomy 5,"Then shalt thou bring forth that man or that woman, which have committed that wicked thing, unto thy gates, even that man or that woman, and shalt stone them with stones, till they die.",1,5,Core,#000000,34,Deuteronomist_source.wikitext,2025-08-18T18:16:26.191513
Deuteronomy 6,"At the mouth of two witnesses, or three witnesses, shall he that is worthy of death be put to death; but at the mouth of one witness he shall not be put to death.",1,6,Core,#000000,34,Deuteronomist_source.wikitext,2025-08-18T18:16:26.191513
Deuteronomy 7,"The hands of the witnesses shall be first upon him to put him to death, and afterward the hands of all the people. So thou shalt put the evil away from among you.",1,7,Core,#000000,33,Deuteronomist_source.wikitext,2025-08-18T18:16:26.191513
Deuteronomy 8,"If there arise a matter too hard for thee in judgment, between blood and blood, between plea and plea, and between stroke and stroke, being matters of controversy within thy gates: then shalt thou arise, and get thee up into the place which the LORD thy God shall choose;",1,8,Core,#000000,49,Deuteronomist_source.wikitext,2025-08-18T18:16:26.191513
Deuteronomy 9,"And thou shalt come unto the priests the Levites, and unto the judge that shall be in those days, and enquire; and they shall shew thee the sentence of judgment:",1,9,Core,#000000,30,Deuteronomist_source.wikitext,2025-08-18T18:16:26.191513
Deuteronomy 10,"And thou shalt do according to the sentence, which they of that place which the LORD shall choose shall shew thee; and thou shalt observe to do according to all that they inform thee:",1,10,Core,#000000,34,Deuteronomist_source.wikitext,2025-08-18T18:16:26.191513
Deuteronomy 11,"According to the sentence of the law which they shall teach thee, and according to the judgment which they shall tell thee, thou shalt do: thou shalt not decline from the sentence which they shall shew thee, to the right hand, nor to the left.",1,11,Core,#000000,45,Deuteronomist_source.wikitext,2025-08-18T18:16:26.192512
Deuteronomy 12,"And the man that will do presumptuously, and will not hearken unto the priest that standeth to minister there before the LORD thy God, or unto the judge, even that man shall die: and thou shalt put away the evil from Israel.",1,12,Core,#000000,42,Deuteronomist_source.wikitext,2025-08-18T18:16:26.192512
Deuteronomy 13,"And all the people shall hear, and fear, and do no more presumptuously.",1,13,Core,#000000,13,Deuteronomist_source.wikitext,2025-08-18T18:16:26.192512
Deuteronomy 14,"When thou art come unto the land which the LORD thy God giveth thee, and shalt possess it, and shalt dwell therein, and shalt say, I will set a king over me, like as all the nations that are about me;",1,14,Core,#000000,41,Deuteronomist_source.wikitext,2025-08-18T18:16:26.192512
Deuteronomy 15,"Thou shalt in any wise set him king over thee, whom the LORD thy God shall choose: one from among thy brethren shalt thou set king over thee: thou mayest not set a stranger over thee, which is not thy brother.",1,15,Core,#000000,41,Deuteronomist_source.wikitext,2025-08-18T18:16:26.192512
Deuteronomy 16,"But he shall not multiply horses to himself, nor cause the people to return to Egypt, to the end that he should multiply horses: forasmuch as the LORD hath said unto you, Ye shall henceforth return no more that way.",1,16,Core,#000000,40,Deuteronomist_source.wikitext,2025-08-18T18:16:26.192512
Deuteronomy 17,"Neither shall he multiply wives to himself, that his heart turn not away: neither shall he greatly multiply to himself silver and gold.",1,17,Core,#000000,23,Deuteronomist_source.wikitext,2025-08-18T18:16:26.192512
Deuteronomy 18,"And it shall be, when he sitteth upon the throne of his kingdom, that he shall write him a copy of this law in a book out of that which is before the priests the Levites:",1,18,Core,#000000,36,Deuteronomist_source.wikitext,2025-08-18T18:16:26.192512
Deuteronomy 19,"And it shall be with him, and he shall read therein all the days of his life: that he may learn to fear the LORD his God, to keep all the words of this law and these statutes, to do them:",1,19,Core,#000000,41,Deuteronomist_source.wikitext,2025-08-18T18:16:26.192512
Deuteronomy 20,"That his heart be not lifted up above his brethren, and that he turn not aside from the commandment, to the right hand, or to the left: to the end that he may prolong his days in his kingdom, he, and his children, in the midst of Israel.",1,20,Core,#000000,48,Deuteronomist_source.wikitext,2025-08-18T18:16:26.192512
Deuteronomy 1,"The priests the Levites, and all the tribe of Levi, shall have no part nor inheritance with Israel: they shall eat the offerings of the LORD made by fire, and his inheritance.",1,1,Core,#000000,32,Deuteronomist_source.wikitext,2025-08-18T18:16:26.192512
Deuteronomy 2,"Therefore shall they have no inheritance among their brethren: the LORD is their inheritance, as he hath said unto them.",1,2,Core,#000000,20,Deuteronomist_source.wikitext,2025-08-18T18:16:26.192512
Deuteronomy 3,"And this shall be the priest's due from the people, from them that offer a sacrifice, whether it be ox or sheep; and they shall give unto the priest the shoulder, and the two cheeks, and the maw.",1,3,Core,#000000,38,Deuteronomist_source.wikitext,2025-08-18T18:16:26.192512
Deuteronomy 4,"The firstfruit also of thy corn, of thy wine, and of thine oil, and the first of the fleece of thy sheep, shalt thou give him.",1,4,Core,#000000,26,Deuteronomist_source.wikitext,2025-08-18T18:16:26.192512
Deuteronomy 5,"For the LORD thy God hath chosen him out of all thy tribes, to stand to minister in the name of the LORD, him and his sons for ever.",1,5,Core,#000000,29,Deuteronomist_source.wikitext,2025-08-18T18:16:26.192512
Deuteronomy 6,"And if a Levite come from any of thy gates out of all Israel, where he sojourned, and come with all the desire of his mind unto the place which the LORD shall choose;",1,6,Core,#000000,34,Deuteronomist_source.wikitext,2025-08-18T18:16:26.192512
Deuteronomy 7,"Then he shall minister in the name of the LORD his God, as all his brethren the Levites do, which stand there before the LORD.",1,7,Core,#000000,25,Deuteronomist_source.wikitext,2025-08-18T18:16:26.193513
Deuteronomy 8,"They shall have like portions to eat, beside that which cometh of the sale of his patrimony.",1,8,Core,#000000,17,Deuteronomist_source.wikitext,2025-08-18T18:16:26.193513
Deuteronomy 9,"When thou art come into the land which the LORD thy God giveth thee, thou shalt not learn to do after the abominations of those nations.",1,9,Core,#000000,26,Deuteronomist_source.wikitext,2025-08-18T18:16:26.193513
Deuteronomy 10,"There shall not be found among you any one that maketh his son or his daughter to pass through the fire, or that useth divination, or an observer of times, or an enchanter, or a witch.",1,10,Core,#000000,36,Deuteronomist_source.wikitext,2025-08-18T18:16:26.193513
Deuteronomy 11,"Or a charmer, or a consulter with familiar spirits, or a wizard, or a necromancer.",1,11,Core,#000000,15,Deuteronomist_source.wikitext,2025-08-18T18:16:26.193513
